[I 2025-05-25 14:52:36,395] Trial 38 finished with value: 0.8693360887492169 and parameters: {'n_estimators': 133, 'max_depth': 45, 'min_samples_split': 0.1302174052181762, 'min_samples_leaf': 0.0762646231968373, 'max_features': 'sqrt', 'bootstrap': True, 'criterion': 'entropy', 'min_weight_fraction_leaf': 0.031657909077085586, 'use_max_leaf_nodes': True, 'max_leaf_nodes': 44, 'min_impurity_decrease': 0.21236493228924933, 'ccp_alpha': 0.09824602231561302, 'class_weight': 'balanced', 'max_samples': 0.5136829951781327}. Best is trial 34 with value: 0.8739418393792014.
[I 2025-05-25 14:52:37,328] Trial 39 finished with value: 0.8534194880824332 and parameters: {'n_estimators': 125, 'max_depth': 49, 'min_samples_split': 0.1328847992136686, 'min_samples_leaf': 0.041705502135260475, 'max_features': 'sqrt', 'bootstrap': True, 'criterion': 'log_loss', 'min_weight_fraction_leaf': 0.41106872294658664, 'use_max_leaf_nodes': True, 'max_leaf_nodes': 33, 'min_impurity_decrease': 0.2181438168713738, 'ccp_alpha': 0.09842243551294473, 'class_weight': 'balanced', 'max_samples': 0.5075051002274857}. Best is trial 34 with value: 0.8739418393792014.
[I 2025-05-25 14:52:38,104] Trial 40 finished with value: 0.8588468455361413 and parameters: {'n_estimators': 108, 'max_depth': 41, 'min_samples_split': 0.17502351909892705, 'min_samples_leaf': 0.07861505464093815, 'max_features': 'sqrt', 'bootstrap': True, 'criterion': 'entropy', 'min_weight_fraction_leaf': 0.03048886916983378, 'use_max_leaf_nodes': True, 'max_leaf_nodes': 47, 'min_impurity_decrease': 0.3465943304392056, 'ccp_alpha': 0.08978513033123138, 'class_weight': 'balanced', 'max_samples': 0.5830667140720268}. Best is trial 34 with value: 0.8739418393792014.
[I 2025-05-25 14:52:39,146] Trial 41 finished with value: 0.8744826665872859 and parameters: {'n_estimators': 142, 'max_depth': 42, 'min_samples_split': 0.05245273988709695, 'min_samples_leaf': 0.07313654022548535, 'max_features': 'sqrt', 'bootstrap': True, 'criterion': 'entropy', 'min_weight_fraction_leaf': 0.02750712796957417, 'use_max_leaf_nodes': True, 'max_leaf_nodes': 156, 'min_impurity_decrease': 0.16211591796887403, 'ccp_alpha': 0.09508916618860648, 'class_weight': 'balanced', 'max_samples': 0.5946390599136037}. Best is trial 41 with value: 0.8744826665872859.
[I 2025-05-25 14:52:40,188] Trial 42 finished with value: 0.8734754537613332 and parameters: {'n_estimators': 141, 'max_depth': 44, 'min_samples_split': 0.10057928178524295, 'min_samples_leaf': 0.0722550096925853, 'max_features': 'sqrt', 'bootstrap': True, 'criterion': 'entropy', 'min_weight_fraction_leaf': 0.024962300646475505, 'use_max_leaf_nodes': True, 'max_leaf_nodes': 302, 'min_impurity_decrease': 0.17047590806535445, 'ccp_alpha': 0.09526467250116565, 'class_weight': 'balanced', 'max_samples': 0.5938850729503107}. Best is trial 41 with value: 0.8744826665872859.
[I 2025-05-25 14:52:41,225] Trial 43 finished with value: 0.870552044993957 and parameters: {'n_estimators': 140, 'max_depth': 44, 'min_samples_split': 0.10856024222702437, 'min_samples_leaf': 0.032262474049620925, 'max_features': 'sqrt', 'bootstrap': True, 'criterion': 'entropy', 'min_weight_fraction_leaf': 0.06185054922397633, 'use_max_leaf_nodes': True, 'max_leaf_nodes': 234, 'min_impurity_decrease': 0.19935782749043932, 'ccp_alpha': 0.09155420885672108, 'class_weight': 'balanced', 'max_samples': 0.6013198690331641}. Best is trial 41 with value: 0.8744826665872859.
[I 2025-05-25 14:52:41,952] Trial 44 finished with value: 0.8711229263116559 and parameters: {'n_estimators': 95, 'max_depth': 39, 'min_samples_split': 0.10016068067311054, 'min_samples_leaf': 0.030531198686989208, 'max_features': 'sqrt', 'bootstrap': True, 'criterion': 'entropy', 'min_weight_fraction_leaf': 0.06447797460979982, 'use_max_leaf_nodes': True, 'max_leaf_nodes': 313, 'min_impurity_decrease': 0.1699820665784607, 'ccp_alpha': 0.0936943471038298, 'class_weight': 'balanced', 'max_samples': 0.614227624057716}. Best is trial 41 with value: 0.8744826665872859.
[I 2025-05-25 14:52:42,694] Trial 45 finished with value: 0.872493843187178 and parameters: {'n_estimators': 101, 'max_depth': 38, 'min_samples_split': 0.09854188517835473, 'min_samples_leaf': 0.03488158924973786, 'max_features': 'sqrt', 'bootstrap': True, 'criterion': 'entropy', 'min_weight_fraction_leaf': 0.20109919559655642, 'use_max_leaf_nodes': True, 'max_leaf_nodes': 279, 'min_impurity_decrease': 0.16910463621798355, 'ccp_alpha': 0.09172158800816461, 'class_weight': 'balanced', 'max_samples': 0.6161481641540466}. Best is trial 41 with value: 0.8744826665872859.
[I 2025-05-25 14:52:43,217] Trial 46 finished with value: 0.8593688043388203 and parameters: {'n_estimators': 54, 'max_depth': 37, 'min_samples_split': 0.07873189283060263, 'min_samples_leaf': 0.029228025422919433, 'max_features': 'sqrt', 'bootstrap': True, 'criterion': 'gini', 'min_weight_fraction_leaf': 0.28477528213824815, 'use_max_leaf_nodes': True, 'max_leaf_nodes': 324, 'min_impurity_decrease': 0.16999963476582736, 'ccp_alpha': 0.0952730675030592, 'class_weight': 'balanced', 'max_samples': 0.6204104337287997}. Best is trial 41 with value: 0.8744826665872859.
[I 2025-05-25 14:52:43,947] Trial 47 finished with value: 0.8760263809108922 and parameters: {'n_estimators': 95, 'max_depth': 50, 'min_samples_split': 0.026556343769149823, 'min_samples_leaf': 0.055756890775675215, 'max_features': 'sqrt', 'bootstrap': True, 'criterion': 'entropy', 'min_weight_fraction_leaf': 0.19519517384822221, 'use_max_leaf_nodes': True, 'max_leaf_nodes': 327, 'min_impurity_decrease': 0.1589453371501414, 'ccp_alpha': 0.03110426057981308, 'class_weight': 'balanced', 'max_samples': 0.6415137481175126}. Best is trial 47 with value: 0.8760263809108922.
[I 2025-05-25 14:52:44,688] Trial 48 finished with value: 0.4312166708985691 and parameters: {'n_estimators': 97, 'max_depth': 50, 'min_samples_split': 0.027874832740859376, 'min_samples_leaf': 0.05692482586509756, 'max_features': 'sqrt', 'bootstrap': True, 'criterion': 'entropy', 'min_weight_fraction_leaf': 0.1986432899012244, 'use_max_leaf_nodes': True, 'max_leaf_nodes': 205, 'min_impurity_decrease': 0.492615728757969, 'ccp_alpha': 0.031251405276427696, 'class_weight': 'balanced', 'max_samples': 0.6596653378268728}. Best is trial 47 with value: 0.8760263809108922.
Best parameters: {'n_estimators': 67, 'max_depth': 35, 'min_samples_split': 0.05748722613588093, 'min_samples_leaf': 0.11721257939163518, 'max_features': 'sqrt', 'bootstrap': True, 'criterion': 'entropy', 'min_weight_fraction_leaf': 0.3393863927150767, 'use_max_leaf_nodes': True, 'max_leaf_nodes': 487, 'min_impurity_decrease': 0.15175521243317408, 'ccp_alpha': 0.0158783199237649, 'class_weight': 'balanced', 'max_samples': 0.5762975243478725}
Best f1 score: 0.8820
[I 2025-05-25 14:52:45,260] Trial 49 finished with value: 0.8819541950758334 and parameters: {'n_estimators': 67, 'max_depth': 35, 'min_samples_split': 0.05748722613588093, 'min_samples_leaf': 0.11721257939163518, 'max_features': 'sqrt', 'bootstrap': True, 'criterion': 'entropy', 'min_weight_fraction_leaf': 0.3393863927150767, 'use_max_leaf_nodes': True, 'max_leaf_nodes': 487, 'min_impurity_decrease': 0.15175521243317408, 'ccp_alpha': 0.0158783199237649, 'class_weight': 'balanced', 'max_samples': 0.5762975243478725}. Best is trial 49 with value: 0.8819541950758334.
              precision    recall  f1-score   support

       False       0.92      0.92      0.92       130
        True       0.86      0.86      0.86        70

    accuracy                           0.90       200
   macro avg       0.89      0.89      0.89       200
weighted avg       0.90      0.90      0.90       200

Max RAM Usage: 0.85 MB
Training time: 0.2486 s
Inference time: 0.0140 s

Process finished with exit code 0
