[I 2025-05-25 18:56:36,923] Trial 33 finished with value: 0.9592716775252927 and parameters: {'booster': 'dart', 'tree_method': 'approx', 'max_depth': 6, 'learning_rate': 0.09028292156714385, 'n_estimators': 531, 'gamma': 0.005329617819757759, 'min_child_weight': 2.1980523330159074, 'max_delta_step': 10, 'subsample': 0.8142682225861211, 'colsample_bytree': 0.6399445141233817, 'colsample_bylevel': 0.611914115282622, 'colsample_bynode': 0.8455652355112304, 'reg_alpha': 5.647418693027651e-08, 'reg_lambda': 0.06627008159055428, 'scale_pos_weight': 1.5621874882157056, 'sample_type': 'uniform', 'normalize_type': 'forest', 'rate_drop': 0.25898007536820844, 'skip_drop': 0.4457401913605546}. Best is trial 4 with value: 0.9659457598389747.
Best trial: 34. Best value: 0.972842:  70%|███████   | 35/50 [08:13<01:37,  6.52s/it][I 2025-05-25 18:56:44,966] Trial 34 finished with value: 0.9728423115631125 and parameters: {'booster': 'dart', 'tree_method': 'approx', 'max_depth': 9, 'learning_rate': 0.2588850921713622, 'n_estimators': 383, 'gamma': 0.00253280886314008, 'min_child_weight': 1.1863336801428834, 'max_delta_step': 9, 'subsample': 0.5012458338522688, 'colsample_bytree': 0.5619487632088898, 'colsample_bylevel': 0.663400598108806, 'colsample_bynode': 0.7897601454508787, 'reg_alpha': 7.739206116686148e-07, 'reg_lambda': 0.0008581961258403584, 'scale_pos_weight': 1.9952250250100096, 'sample_type': 'uniform', 'normalize_type': 'tree', 'rate_drop': 0.30509202915547706, 'skip_drop': 0.5310249845529623}. Best is trial 34 with value: 0.9728423115631125.
Best trial: 34. Best value: 0.972842:  72%|███████▏  | 36/50 [08:21<01:38,  7.02s/it][I 2025-05-25 18:56:53,161] Trial 35 finished with value: 0.9592865088193232 and parameters: {'booster': 'dart', 'tree_method': 'approx', 'max_depth': 2, 'learning_rate': 0.23149152780177956, 'n_estimators': 389, 'gamma': 0.0024819201597515977, 'min_child_weight': 0.9777471737295735, 'max_delta_step': 6, 'subsample': 0.6428548903832234, 'colsample_bytree': 0.6003854734873031, 'colsample_bylevel': 0.7413448110284441, 'colsample_bynode': 0.7521070738081796, 'reg_alpha': 1.2901057651604897e-06, 'reg_lambda': 0.0016204829641375846, 'scale_pos_weight': 0.7680692801979505, 'sample_type': 'uniform', 'normalize_type': 'tree', 'rate_drop': 0.3235980436046812, 'skip_drop': 0.48120271184334334}. Best is trial 34 with value: 0.9728423115631125.
[I 2025-05-25 18:56:53,976] Trial 36 finished with value: 0.9457322951427513 and parameters: {'booster': 'gblinear', 'learning_rate': 0.3567645061426026, 'n_estimators': 721, 'reg_alpha': 7.181344294564332e-06, 'reg_lambda': 9.40137170363992e-05, 'scale_pos_weight': 1.476190590218229}. Best is trial 34 with value: 0.9728423115631125.
Best trial: 34. Best value: 0.972842:  76%|███████▌  | 38/50 [08:32<01:17,  6.49s/it][I 2025-05-25 18:57:03,579] Trial 37 finished with value: 0.9456399306107317 and parameters: {'booster': 'dart', 'tree_method': 'approx', 'max_depth': 4, 'learning_rate': 0.2656789623103843, 'n_estimators': 480, 'gamma': 0.008221643558477962, 'min_child_weight': 4.751081844933996, 'max_delta_step': 3, 'subsample': 0.5240864721427074, 'colsample_bytree': 0.6951923404390666, 'colsample_bylevel': 0.6545549143018338, 'colsample_bynode': 0.7853676882564544, 'reg_alpha': 2.455429013503923e-08, 'reg_lambda': 8.76005440401611e-06, 'scale_pos_weight': 1.9659759520970388, 'sample_type': 'weighted', 'normalize_type': 'tree', 'rate_drop': 0.8332860501282421, 'skip_drop': 0.6766451470261097}. Best is trial 34 with value: 0.9728423115631125.
Best trial: 34. Best value: 0.972842:  78%|███████▊  | 39/50 [08:34<00:57,  5.22s/it][I 2025-05-25 18:57:05,837] Trial 38 finished with value: 0.9186439792543798 and parameters: {'booster': 'gbtree', 'tree_method': 'hist', 'max_depth': 7, 'learning_rate': 0.02601809349073718, 'n_estimators': 1324, 'gamma': 0.0019665873707678475, 'min_child_weight': 9.189645235567017, 'max_delta_step': 8, 'subsample': 0.8125493233569092, 'colsample_bytree': 0.6559909468734466, 'colsample_bylevel': 0.6819811312402195, 'colsample_bynode': 0.7082704701271434, 'reg_alpha': 1.518306131155194e-07, 'reg_lambda': 0.00024888869900420327, 'scale_pos_weight': 1.7546627824014993}. Best is trial 34 with value: 0.9728423115631125.
Best trial: 34. Best value: 0.972842:  80%|████████  | 40/50 [08:53<01:33,  9.34s/it][I 2025-05-25 18:57:24,777] Trial 39 finished with value: 0.9525529026961175 and parameters: {'booster': 'dart', 'tree_method': 'approx', 'max_depth': 5, 'learning_rate': 0.6093422828159778, 'n_estimators': 654, 'gamma': 0.01651532250922374, 'min_child_weight': 1.1793703058085991, 'max_delta_step': 2, 'subsample': 0.7064170320421957, 'colsample_bytree': 0.5353456533166353, 'colsample_bylevel': 0.7927763798589323, 'colsample_bynode': 0.7696993455997208, 'reg_alpha': 4.7939870001504645e-05, 'reg_lambda': 1.5867411149403907e-07, 'scale_pos_weight': 0.9680723928621094, 'sample_type': 'uniform', 'normalize_type': 'tree', 'rate_drop': 0.31454748665596716, 'skip_drop': 0.3295624538166331}. Best is trial 34 with value: 0.9728423115631125.
Best trial: 34. Best value: 0.972842:  82%|████████▏ | 41/50 [08:54<01:02,  6.90s/it][I 2025-05-25 18:57:25,988] Trial 40 finished with value: 0.9526124265056414 and parameters: {'booster': 'gbtree', 'tree_method': 'auto', 'max_depth': 2, 'learning_rate': 0.03998496614063921, 'n_estimators': 827, 'gamma': 0.0061065174530582625, 'min_child_weight': 2.681969131920704, 'max_delta_step': 4, 'subsample': 0.7837513894367227, 'colsample_bytree': 0.5847530147919727, 'colsample_bylevel': 0.6278082027075468, 'colsample_bynode': 0.8230018635828469, 'reg_alpha': 7.513081240508155e-07, 'reg_lambda': 1.146113356274782e-08, 'scale_pos_weight': 1.080954945311446}. Best is trial 34 with value: 0.9728423115631125.
[I 2025-05-25 18:57:29,091] Trial 41 finished with value: 0.9592269850097994 and parameters: {'booster': 'dart', 'tree_method': 'approx', 'max_depth': 9, 'learning_rate': 0.17328508998070535, 'n_estimators': 223, 'gamma': 0.0018392955882771823, 'min_child_weight': 1.4766281556153884, 'max_delta_step': 9, 'subsample': 0.8655653243250915, 'colsample_bytree': 0.5483607398821578, 'colsample_bylevel': 0.5554186304846152, 'colsample_bynode': 0.9300629895399258, 'reg_alpha': 3.8990502109765747e-07, 'reg_lambda': 0.14603829865784385, 'scale_pos_weight': 1.8616449058317612, 'sample_type': 'uniform', 'normalize_type': 'tree', 'rate_drop': 0.18908079100621092, 'skip_drop': 0.9633943677459474}. Best is trial 34 with value: 0.9728423115631125.
Best trial: 34. Best value: 0.972842:  86%|████████▌ | 43/50 [09:02<00:39,  5.60s/it][I 2025-05-25 18:57:34,314] Trial 42 finished with value: 0.9592865088193232 and parameters: {'booster': 'dart', 'tree_method': 'approx', 'max_depth': 10, 'learning_rate': 0.1172038507802732, 'n_estimators': 308, 'gamma': 0.0050695751921524795, 'min_child_weight': 0.8114703211453371, 'max_delta_step': 9, 'subsample': 0.8262125608668863, 'colsample_bytree': 0.503745672830004, 'colsample_bylevel': 0.5893451822967184, 'colsample_bynode': 0.8658626013145643, 'reg_alpha': 3.6667117835437656e-06, 'reg_lambda': 0.012938021194336171, 'scale_pos_weight': 1.6960665538800415, 'sample_type': 'uniform', 'normalize_type': 'forest', 'rate_drop': 0.1540351477183201, 'skip_drop': 0.6904204340405694}. Best is trial 34 with value: 0.9728423115631125.
[I 2025-05-25 18:57:36,165] Trial 43 finished with value: 0.9592865088193232 and parameters: {'booster': 'dart', 'tree_method': 'approx', 'max_depth': 10, 'learning_rate': 0.06714589598773185, 'n_estimators': 179, 'gamma': 0.056721116460040216, 'min_child_weight': 1.3052850773832083, 'max_delta_step': 8, 'subsample': 0.9946203182591707, 'colsample_bytree': 0.6324426010320464, 'colsample_bylevel': 0.5378313483426304, 'colsample_bynode': 0.8142949556016166, 'reg_alpha': 1.1311825811382212e-07, 'reg_lambda': 0.000845127600553425, 'scale_pos_weight': 0.6088692018585341, 'sample_type': 'uniform', 'normalize_type': 'forest', 'rate_drop': 0.38348855878143984, 'skip_drop': 0.82866665101459}. Best is trial 34 with value: 0.9728423115631125.
Best trial: 34. Best value: 0.972842:  90%|█████████ | 45/50 [10:15<02:01, 24.36s/it][I 2025-05-25 18:58:46,935] Trial 44 finished with value: 0.9525529026961175 and parameters: {'booster': 'dart', 'tree_method': 'approx', 'max_depth': 8, 'learning_rate': 0.10632014492126159, 'n_estimators': 1194, 'gamma': 0.003783289113106044, 'min_child_weight': 2.0298612690532565, 'max_delta_step': 10, 'subsample': 0.5061978654584844, 'colsample_bytree': 0.5740565890042931, 'colsample_bylevel': 0.6017504780088174, 'colsample_bynode': 0.9391534364171596, 'reg_alpha': 2.1960418902711858e-08, 'reg_lambda': 3.4395598534591865, 'scale_pos_weight': 1.5647789706833208, 'sample_type': 'uniform', 'normalize_type': 'tree', 'rate_drop': 0.020531672082208074, 'skip_drop': 0.5704846393032863}. Best is trial 34 with value: 0.9728423115631125.
[I 2025-05-25 18:58:54,031] Trial 45 finished with value: 0.9525975952116109 and parameters: {'booster': 'dart', 'tree_method': 'approx', 'max_depth': 12, 'learning_rate': 0.5990197631877504, 'n_estimators': 461, 'gamma': 0.001844634565097297, 'min_child_weight': 0.5986367657724282, 'max_delta_step': 7, 'subsample': 0.9090842446229654, 'colsample_bytree': 0.665369877469689, 'colsample_bylevel': 0.6425733709164535, 'colsample_bynode': 0.8480288631368932, 'reg_alpha': 1.958121049155715e-06, 'reg_lambda': 0.04441855891482717, 'scale_pos_weight': 1.4038003358194526, 'sample_type': 'uniform', 'normalize_type': 'tree', 'rate_drop': 0.687300751025266, 'skip_drop': 0.3462650029225528}. Best is trial 34 with value: 0.9728423115631125.
Best trial: 34. Best value: 0.972842:  94%|█████████▍| 47/50 [10:28<00:45, 15.08s/it][I 2025-05-25 18:58:59,544] Trial 46 finished with value: 0.9659457598389747 and parameters: {'booster': 'dart', 'tree_method': 'hist', 'max_depth': 8, 'learning_rate': 0.03617413803132787, 'n_estimators': 281, 'gamma': 0.024220146845749604, 'min_child_weight': 0.9613811867246725, 'max_delta_step': 9, 'subsample': 0.5616005155039824, 'colsample_bytree': 0.6032959412905585, 'colsample_bylevel': 0.6990835629876964, 'colsample_bynode': 0.700729041173126, 'reg_alpha': 3.4545378637147507e-07, 'reg_lambda': 0.009226014154418106, 'scale_pos_weight': 1.9862030826242132, 'sample_type': 'uniform', 'normalize_type': 'forest', 'rate_drop': 0.4257839268106961, 'skip_drop': 0.9036628572775259}. Best is trial 34 with value: 0.9728423115631125.
Best trial: 34. Best value: 0.972842:  96%|█████████▌| 48/50 [10:29<00:21, 10.95s/it][I 2025-05-25 18:59:00,845] Trial 47 finished with value: 0.9526124265056414 and parameters: {'booster': 'gbtree', 'tree_method': 'auto', 'max_depth': 20, 'learning_rate': 0.025381375381646035, 'n_estimators': 921, 'gamma': 0.009835735013995003, 'min_child_weight': 3.3442718125320536, 'max_delta_step': 8, 'subsample': 0.6124291115159503, 'colsample_bytree': 0.5310858677509961, 'colsample_bylevel': 0.5315303509301378, 'colsample_bynode': 0.8968042791931531, 'reg_alpha': 9.476982217164174e-06, 'reg_lambda': 0.8155899988169147, 'scale_pos_weight': 1.3122822095051114}. Best is trial 34 with value: 0.9728423115631125.
[I 2025-05-25 18:59:01,854] Trial 48 finished with value: 0.9659457598389747 and parameters: {'booster': 'gbtree', 'tree_method': 'approx', 'max_depth': 14, 'learning_rate': 0.047720307175718096, 'n_estimators': 405, 'gamma': 1.123760488003763, 'min_child_weight': 1.9588346025647163, 'max_delta_step': 2, 'subsample': 0.8425869237874576, 'colsample_bytree': 0.5875610463488542, 'colsample_bylevel': 0.675031823053457, 'colsample_bynode': 0.7401174927641959, 'reg_alpha': 7.815876652258291e-08, 'reg_lambda': 0.21272508717747976, 'scale_pos_weight': 1.8574738721632498}. Best is trial 34 with value: 0.9728423115631125.
Best trial: 34. Best value: 0.972842: 100%|██████████| 50/50 [10:32<00:00, 12.66s/it]
[I 2025-05-25 18:59:04,390] Trial 49 finished with value: 0.9525975952116109 and parameters: {'booster': 'gbtree', 'tree_method': 'hist', 'max_depth': 9, 'learning_rate': 0.1568648287615407, 'n_estimators': 1754, 'gamma': 0.08316529366500323, 'min_child_weight': 1.1965317020017079, 'max_delta_step': 10, 'subsample': 0.8692868640889783, 'colsample_bytree': 0.6765075538405111, 'colsample_bylevel': 0.7227684753204892, 'colsample_bynode': 0.630400695280528, 'reg_alpha': 3.824636592602208e-05, 'reg_lambda': 0.8167934471013495, 'scale_pos_weight': 0.8615175776828563}. Best is trial 34 with value: 0.9728423115631125.

Лучшие параметры: {'booster': 'dart', 'tree_method': 'approx', 'max_depth': 9, 'learning_rate': 0.2588850921713622, 'n_estimators': 383, 'gamma': 0.00253280886314008, 'min_child_weight': 1.1863336801428834, 'max_delta_step': 9, 'subsample': 0.5012458338522688, 'colsample_bytree': 0.5619487632088898, 'colsample_bylevel': 0.663400598108806, 'colsample_bynode': 0.7897601454508787, 'reg_alpha': 7.739206116686148e-07, 'reg_lambda': 0.0008581961258403584, 'scale_pos_weight': 1.9952250250100096, 'sample_type': 'uniform', 'normalize_type': 'tree', 'rate_drop': 0.30509202915547706, 'skip_drop': 0.5310249845529623}
Лучшее значение f1_macro: 0.9728
C:\Users\bakhtiyar\.conda\envs\myenv\lib\site-packages\xgboost\training.py:183: UserWarning: [18:59:04] WARNING: C:\actions-runner\_work\xgboost\xgboost\src\learner.cc:738:
Parameters: { "use_label_encoder" } are not used.

  bst.update(dtrain, iteration=i, fobj=obj)

Подбор оптимального порога для предсказаний:
Порог: 0.10, F1-macro: 0.7222
Порог: 0.15, F1-macro: 0.7222
Порог: 0.20, F1-macro: 0.8198
Порог: 0.25, F1-macro: 0.8198
Порог: 0.30, F1-macro: 0.4737
Порог: 0.35, F1-macro: 0.4737
Порог: 0.40, F1-macro: 0.4737
Порог: 0.45, F1-macro: 0.4737
Порог: 0.50, F1-macro: 0.4737
Порог: 0.55, F1-macro: 0.4737
Порог: 0.60, F1-macro: 0.4737
Порог: 0.65, F1-macro: 0.4737
Порог: 0.70, F1-macro: 0.4737
Порог: 0.75, F1-macro: 0.4737
Порог: 0.80, F1-macro: 0.4737
Порог: 0.85, F1-macro: 0.4737

Выбран оптимальный порог: 0.20 с F1-macro: 0.8198

Результаты оценки модели:
              precision    recall  f1-score   support

       False       0.95      1.00      0.97        18
        True       1.00      0.50      0.67         2

    accuracy                           0.95        20
   macro avg       0.97      0.75      0.82        20
weighted avg       0.95      0.95      0.94        20


Время обучения: 1.4941 с
Использование памяти: 0.14 MB
Время предсказания: 0.0105 с

ROC-AUC: 0.9722
PR-AUC: 0.7917

Для визуализации результатов установите дополнительные библиотеки: Tried to import 'plotly' but failed. Please make sure that the package is installed correctly to use this feature. Actual error: No module named 'plotly'.

Process finished with exit code 0
