C:\Users\bakhtiyar\.conda\envs\myenv\python.exe C:\Users\bakhtiyar\Projects\LazyUp_AI_Module\process_names\exp_v1_cnn_classifier.py
       timestamp  ...   mode
0  1745197431078  ...  False
1  1745197491078  ...  False
2  1745197551078  ...  False
3  1745197611078  ...  False
4  1745197671078  ...  False

[5 rows x 6 columns]
[I 2025-05-25 12:11:02,822] A new study created in memory with name: no-name-7a15374e-0e60-4c0c-8c32-b8093c0860bd
2025-05-25 12:11:02.830481: I tensorflow/core/platform/cpu_feature_guard.cc:193] This TensorFlow binary is optimized with oneAPI Deep Neural Network Library (oneDNN) to use the following CPU instructions in performance-critical operations:  AVX2
To enable them in other operations, rebuild TensorFlow with the appropriate compiler flags.
2025-05-25 12:11:02.831598: I tensorflow/core/common_runtime/process_util.cc:146] Creating new thread pool with default inter op setting: 2. Tune using inter_op_parallelism_threads for best performance.
Layer shapes:
input_1: [(None, 37)]
embedding: (None, 37, 17)
conv1d: (None, 37, 64)
dropout: (None, 37, 64)
conv1d_1: (None, 37, 256)
max_pooling1d: (None, 18, 256)
dropout_1: (None, 18, 256)
conv1d_2: (None, 16, 64)
dropout_2: (None, 16, 64)
global_max_pooling1d: (None, 64)
input_2: [(None, 1)]
concatenate: (None, 65)
dense: (None, 222)
dropout_3: (None, 222)
dense_1: (None, 143)
dense_2: (None, 1)
[I 2025-05-25 12:11:21,059] Trial 0 finished with value: 0.898809552192688 and parameters: {'embedding_dim': 17, 'n_conv_layers': 3, 'filters_0': 64, 'kernel_size_0': 2, 'activation_conv_0': 'selu', 'padding_0': 'same', 'use_pooling_0': True, 'pool_size_0': 1, 'use_dropout_conv_0': True, 'dropout_rate_conv_0': 0.34936419452074174, 'filters_1': 256, 'kernel_size_1': 2, 'activation_conv_1': 'elu', 'padding_1': 'same', 'use_pooling_1': True, 'pool_size_1': 2, 'use_dropout_conv_1': True, 'dropout_rate_conv_1': 0.19952884970005444, 'filters_2': 64, 'kernel_size_2': 3, 'activation_conv_2': 'relu', 'padding_2': 'valid', 'use_pooling_2': False, 'use_dropout_conv_2': True, 'dropout_rate_conv_2': 0.22262131774743948, 'global_pooling': 'max', 'n_dense_layers': 2, 'dense_units_0': 222, 'activation_dense_0': 'relu', 'use_dropout_dense_0': True, 'dropout_rate_dense_0': 0.1954878488079388, 'dense_units_1': 143, 'activation_dense_1': 'elu', 'use_dropout_dense_1': False, 'optimizer': 'rmsprop', 'learning_rate': 0.0002143054966462011, 'rho': 0.9246734921217753, 'loss': 'binary_focal_loss', 'focal_loss_gamma': 2.468906502198709, 'focal_loss_alpha': 0.31671017859314055, 'batch_size': 16, 'patience': 7}. Best is trial 0 with value: 0.898809552192688.
Layer shapes:
input_3: [(None, 37)]
embedding_1: (None, 37, 63)
conv1d_3: (None, 35, 256)
max_pooling1d_1: (None, 17, 256)
dropout_4: (None, 17, 256)
global_max_pooling1d_1: (None, 256)
input_4: [(None, 1)]
concatenate_1: (None, 257)
dense_3: (None, 198)
dense_4: (None, 126)
dropout_5: (None, 126)
dense_5: (None, 229)
dropout_6: (None, 229)
dense_6: (None, 1)
[I 2025-05-25 12:11:31,255] Trial 1 finished with value: 0.9084821343421936 and parameters: {'embedding_dim': 63, 'n_conv_layers': 1, 'filters_0': 256, 'kernel_size_0': 3, 'activation_conv_0': 'elu', 'padding_0': 'valid', 'use_pooling_0': True, 'pool_size_0': 2, 'use_dropout_conv_0': True, 'dropout_rate_conv_0': 0.2751128611852268, 'global_pooling': 'max', 'n_dense_layers': 3, 'dense_units_0': 198, 'activation_dense_0': 'relu', 'use_dropout_dense_0': False, 'dense_units_1': 126, 'activation_dense_1': 'elu', 'use_dropout_dense_1': True, 'dropout_rate_dense_1': 0.33778832616257715, 'dense_units_2': 229, 'activation_dense_2': 'elu', 'use_dropout_dense_2': True, 'dropout_rate_dense_2': 0.3065809296039197, 'optimizer': 'rmsprop', 'learning_rate': 0.005594533957666432, 'rho': 0.8503855274039381, 'loss': 'binary_crossentropy', 'batch_size': 16, 'patience': 7}. Best is trial 1 with value: 0.9084821343421936.
Layer shapes:
input_5: [(None, 37)]
embedding_2: (None, 37, 67)
conv1d_4: (None, 36, 64)
max_pooling1d_2: (None, 18, 64)
global_average_pooling1d: (None, 64)
input_6: [(None, 1)]
concatenate_2: (None, 65)
dense_7: (None, 176)
dropout_7: (None, 176)
dense_8: (None, 38)
dense_9: (None, 189)
dense_10: (None, 1)
[I 2025-05-25 12:11:35,072] Trial 2 finished with value: 0.9188988208770752 and parameters: {'embedding_dim': 67, 'n_conv_layers': 1, 'filters_0': 64, 'kernel_size_0': 2, 'activation_conv_0': 'relu', 'padding_0': 'valid', 'use_pooling_0': True, 'pool_size_0': 2, 'use_dropout_conv_0': False, 'global_pooling': 'avg', 'n_dense_layers': 3, 'dense_units_0': 176, 'activation_dense_0': 'elu', 'use_dropout_dense_0': True, 'dropout_rate_dense_0': 0.4704246744766868, 'dense_units_1': 38, 'activation_dense_1': 'elu', 'use_dropout_dense_1': False, 'dense_units_2': 189, 'activation_dense_2': 'relu', 'use_dropout_dense_2': False, 'optimizer': 'rmsprop', 'learning_rate': 0.0030533498647105296, 'rho': 0.9645692339104646, 'loss': 'binary_crossentropy', 'batch_size': 128, 'patience': 10}. Best is trial 2 with value: 0.9188988208770752.
Layer shapes:
input_7: [(None, 37)]
embedding_3: (None, 37, 29)
conv1d_5: (None, 37, 128)
dropout_8: (None, 37, 128)
conv1d_6: (None, 37, 32)
dropout_9: (None, 37, 32)
global_max_pooling1d_2: (None, 32)
input_8: [(None, 1)]
concatenate_3: (None, 33)
dense_11: (None, 178)
dense_12: (None, 170)
dense_13: (None, 1)
Layer shapes:
input_9: [(None, 37)]
embedding_4: (None, 37, 34)
conv1d_7: (None, 37, 256)
global_average_pooling1d_1: (None, 256)
input_10: [(None, 1)]
concatenate_4: (None, 257)
dense_14: (None, 26)
dropout_10: (None, 26)
dense_15: (None, 112)
dense_16: (None, 1)
[I 2025-05-25 12:11:39,753] Trial 3 finished with value: 0.609375 and parameters: {'embedding_dim': 29, 'n_conv_layers': 2, 'filters_0': 128, 'kernel_size_0': 2, 'activation_conv_0': 'relu', 'padding_0': 'same', 'use_pooling_0': False, 'use_dropout_conv_0': True, 'dropout_rate_conv_0': 0.19293240854795154, 'filters_1': 32, 'kernel_size_1': 5, 'activation_conv_1': 'relu', 'padding_1': 'same', 'use_pooling_1': False, 'use_dropout_conv_1': True, 'dropout_rate_conv_1': 0.3417048573660043, 'global_pooling': 'max', 'n_dense_layers': 2, 'dense_units_0': 178, 'activation_dense_0': 'selu', 'use_dropout_dense_0': False, 'dense_units_1': 170, 'activation_dense_1': 'relu', 'use_dropout_dense_1': False, 'optimizer': 'sgd', 'learning_rate': 0.000823836902890338, 'momentum': 0.5287968825187749, 'loss': 'binary_focal_loss', 'focal_loss_gamma': 1.703195401555922, 'focal_loss_alpha': 0.10685565813043443, 'batch_size': 128, 'patience': 8}. Best is trial 2 with value: 0.9188988208770752.
Layer shapes:
input_11: [(None, 37)]
embedding_5: (None, 37, 22)
conv1d_8: (None, 37, 32)
dropout_11: (None, 37, 32)
global_max_pooling1d_3: (None, 32)
input_12: [(None, 1)]
concatenate_5: (None, 33)
dense_17: (None, 247)
dropout_12: (None, 247)
dense_18: (None, 1)
[I 2025-05-25 12:11:43,573] Trial 4 finished with value: 0.4813988208770752 and parameters: {'embedding_dim': 34, 'n_conv_layers': 1, 'filters_0': 256, 'kernel_size_0': 4, 'activation_conv_0': 'selu', 'padding_0': 'same', 'use_pooling_0': False, 'use_dropout_conv_0': False, 'global_pooling': 'avg', 'n_dense_layers': 2, 'dense_units_0': 26, 'activation_dense_0': 'elu', 'use_dropout_dense_0': True, 'dropout_rate_dense_0': 0.15000441432306766, 'dense_units_1': 112, 'activation_dense_1': 'selu', 'use_dropout_dense_1': False, 'optimizer': 'sgd', 'learning_rate': 0.0002916756796648175, 'momentum': 0.05605254930209731, 'loss': 'binary_focal_loss', 'focal_loss_gamma': 2.74330276595938, 'focal_loss_alpha': 0.6829357039488855, 'batch_size': 128, 'patience': 7}. Best is trial 2 with value: 0.9188988208770752.
[I 2025-05-25 12:11:45,669] Trial 5 finished with value: 0.9002976417541504 and parameters: {'embedding_dim': 22, 'n_conv_layers': 1, 'filters_0': 32, 'kernel_size_0': 5, 'activation_conv_0': 'selu', 'padding_0': 'same', 'use_pooling_0': False, 'use_dropout_conv_0': True, 'dropout_rate_conv_0': 0.276125949790353, 'global_pooling': 'max', 'n_dense_layers': 1, 'dense_units_0': 247, 'activation_dense_0': 'selu', 'use_dropout_dense_0': True, 'dropout_rate_dense_0': 0.2588968705151893, 'optimizer': 'adam', 'learning_rate': 0.004254314993027146, 'beta1': 0.9009234804381269, 'beta2': 0.9149931560391737, 'loss': 'binary_focal_loss', 'focal_loss_gamma': 1.766533441694157, 'focal_loss_alpha': 0.7672727938623779, 'batch_size': 128, 'patience': 7}. Best is trial 2 with value: 0.9188988208770752.
Layer shapes:
input_13: [(None, 37)]
embedding_6: (None, 37, 103)
conv1d_9: (None, 37, 32)
dropout_13: (None, 37, 32)
global_max_pooling1d_4: (None, 32)
input_14: [(None, 1)]
concatenate_6: (None, 33)
dense_19: (None, 63)
dense_20: (None, 1)
[I 2025-05-25 12:11:49,571] Trial 6 finished with value: 0.9241071343421936 and parameters: {'embedding_dim': 103, 'n_conv_layers': 1, 'filters_0': 32, 'kernel_size_0': 3, 'activation_conv_0': 'selu', 'padding_0': 'same', 'use_pooling_0': False, 'use_dropout_conv_0': True, 'dropout_rate_conv_0': 0.3428218350065193, 'global_pooling': 'max', 'n_dense_layers': 1, 'dense_units_0': 63, 'activation_dense_0': 'elu', 'use_dropout_dense_0': False, 'optimizer': 'rmsprop', 'learning_rate': 0.006182179787065901, 'rho': 0.9875986793844692, 'loss': 'binary_crossentropy', 'batch_size': 64, 'patience': 4}. Best is trial 6 with value: 0.9241071343421936.
Layer shapes:
input_15: [(None, 37)]
embedding_7: (None, 37, 72)
conv1d_10: (None, 37, 64)
dropout_14: (None, 37, 64)
conv1d_11: (None, 37, 256)
dropout_15: (None, 37, 256)
conv1d_12: (None, 37, 128)
dropout_16: (None, 37, 128)
global_average_pooling1d_2: (None, 128)
input_16: [(None, 1)]
concatenate_7: (None, 129)
dense_21: (None, 223)
dense_22: (None, 1)
[I 2025-05-25 12:11:59,415] Trial 7 finished with value: 0.609375 and parameters: {'embedding_dim': 72, 'n_conv_layers': 3, 'filters_0': 64, 'kernel_size_0': 5, 'activation_conv_0': 'selu', 'padding_0': 'same', 'use_pooling_0': False, 'use_dropout_conv_0': True, 'dropout_rate_conv_0': 0.3641745845997817, 'filters_1': 256, 'kernel_size_1': 5, 'activation_conv_1': 'relu', 'padding_1': 'same', 'use_pooling_1': False, 'use_dropout_conv_1': True, 'dropout_rate_conv_1': 0.31765776577095706, 'filters_2': 128, 'kernel_size_2': 3, 'activation_conv_2': 'selu', 'padding_2': 'same', 'use_pooling_2': True, 'pool_size_2': 1, 'use_dropout_conv_2': True, 'dropout_rate_conv_2': 0.14861259906264568, 'global_pooling': 'avg', 'n_dense_layers': 1, 'dense_units_0': 223, 'activation_dense_0': 'relu', 'use_dropout_dense_0': False, 'optimizer': 'sgd', 'learning_rate': 0.00013289540440563792, 'momentum': 0.8580010734029985, 'loss': 'binary_crossentropy', 'batch_size': 16, 'patience': 5}. Best is trial 6 with value: 0.9241071343421936.
Layer shapes:
input_17: [(None, 37)]
embedding_8: (None, 37, 73)
conv1d_13: (None, 37, 256)
conv1d_14: (None, 35, 128)
global_average_pooling1d_3: (None, 128)
input_18: [(None, 1)]
concatenate_8: (None, 129)
dense_23: (None, 156)
dropout_17: (None, 156)
dense_24: (None, 178)
dropout_18: (None, 178)
dense_25: (None, 1)
[I 2025-05-25 12:12:12,182] Trial 8 finished with value: 0.6153273582458496 and parameters: {'embedding_dim': 73, 'n_conv_layers': 2, 'filters_0': 256, 'kernel_size_0': 4, 'activation_conv_0': 'relu', 'padding_0': 'same', 'use_pooling_0': True, 'pool_size_0': 1, 'use_dropout_conv_0': False, 'filters_1': 128, 'kernel_size_1': 3, 'activation_conv_1': 'relu', 'padding_1': 'valid', 'use_pooling_1': False, 'use_dropout_conv_1': False, 'global_pooling': 'avg', 'n_dense_layers': 2, 'dense_units_0': 156, 'activation_dense_0': 'elu', 'use_dropout_dense_0': True, 'dropout_rate_dense_0': 0.43166057018354, 'dense_units_1': 178, 'activation_dense_1': 'selu', 'use_dropout_dense_1': True, 'dropout_rate_dense_1': 0.37332998243018356, 'optimizer': 'sgd', 'learning_rate': 0.0007996990256928048, 'momentum': 0.621850584719284, 'loss': 'binary_focal_loss', 'focal_loss_gamma': 2.6832283732024393, 'focal_loss_alpha': 0.5818517064410488, 'batch_size': 16, 'patience': 9}. Best is trial 6 with value: 0.9241071343421936.
Layer shapes:
input_19: [(None, 37)]
embedding_9: (None, 37, 72)
conv1d_15: (None, 34, 256)
max_pooling1d_3: (None, 17, 256)
global_average_pooling1d_4: (None, 256)
input_20: [(None, 1)]
concatenate_9: (None, 257)
dense_26: (None, 123)
dense_27: (None, 1)
[I 2025-05-25 12:12:20,893] Trial 9 finished with value: 0.9151785969734192 and parameters: {'embedding_dim': 72, 'n_conv_layers': 1, 'filters_0': 256, 'kernel_size_0': 4, 'activation_conv_0': 'relu', 'padding_0': 'valid', 'use_pooling_0': True, 'pool_size_0': 2, 'use_dropout_conv_0': False, 'global_pooling': 'avg', 'n_dense_layers': 1, 'dense_units_0': 123, 'activation_dense_0': 'elu', 'use_dropout_dense_0': False, 'optimizer': 'rmsprop', 'learning_rate': 0.00013222480851262907, 'rho': 0.8096242881716936, 'loss': 'binary_focal_loss', 'focal_loss_gamma': 2.175716172638309, 'focal_loss_alpha': 0.7054014501538168, 'batch_size': 16, 'patience': 4}. Best is trial 6 with value: 0.9241071343421936.
Layer shapes:
input_21: [(None, 37)]
embedding_10: (None, 37, 107)
conv1d_16: (None, 35, 32)
dropout_19: (None, 35, 32)
conv1d_17: (None, 34, 64)
global_max_pooling1d_5: (None, 64)
input_22: [(None, 1)]
concatenate_10: (None, 65)
dense_28: (None, 70)
dense_29: (None, 1)
[I 2025-05-25 12:12:22,761] Trial 10 finished with value: 0.8816964030265808 and parameters: {'embedding_dim': 107, 'n_conv_layers': 2, 'filters_0': 32, 'kernel_size_0': 3, 'activation_conv_0': 'elu', 'padding_0': 'valid', 'use_pooling_0': False, 'use_dropout_conv_0': True, 'dropout_rate_conv_0': 0.44648354168799065, 'filters_1': 64, 'kernel_size_1': 2, 'activation_conv_1': 'selu', 'padding_1': 'valid', 'use_pooling_1': True, 'pool_size_1': 1, 'use_dropout_conv_1': False, 'global_pooling': 'max', 'n_dense_layers': 1, 'dense_units_0': 70, 'activation_dense_0': 'elu', 'use_dropout_dense_0': False, 'optimizer': 'adam', 'learning_rate': 0.009469983436146391, 'beta1': 0.9977287246495841, 'beta2': 0.8131947560270254, 'loss': 'binary_crossentropy', 'batch_size': 64, 'patience': 3}. Best is trial 6 with value: 0.9241071343421936.
Layer shapes:
input_23: [(None, 37)]
embedding_11: (None, 37, 125)
conv1d_18: (None, 36, 64)
max_pooling1d_4: (None, 18, 64)
global_average_pooling1d_5: (None, 64)
input_24: [(None, 1)]
concatenate_11: (None, 65)
dense_30: (None, 85)
dropout_20: (None, 85)
dense_31: (None, 20)
dense_32: (None, 107)
dense_33: (None, 1)
[I 2025-05-25 12:12:27,249] Trial 11 finished with value: 0.9188988208770752 and parameters: {'embedding_dim': 125, 'n_conv_layers': 1, 'filters_0': 64, 'kernel_size_0': 2, 'activation_conv_0': 'relu', 'padding_0': 'valid', 'use_pooling_0': True, 'pool_size_0': 2, 'use_dropout_conv_0': False, 'global_pooling': 'avg', 'n_dense_layers': 3, 'dense_units_0': 85, 'activation_dense_0': 'elu', 'use_dropout_dense_0': True, 'dropout_rate_dense_0': 0.4928430012495919, 'dense_units_1': 20, 'activation_dense_1': 'elu', 'use_dropout_dense_1': False, 'dense_units_2': 107, 'activation_dense_2': 'relu', 'use_dropout_dense_2': False, 'optimizer': 'rmsprop', 'learning_rate': 0.00243978986179404, 'rho': 0.9891787416065366, 'loss': 'binary_crossentropy', 'batch_size': 64, 'patience': 10}. Best is trial 6 with value: 0.9241071343421936.
Layer shapes:
input_25: [(None, 37)]
embedding_12: (None, 37, 103)
conv1d_19: (None, 35, 32)
max_pooling1d_5: (None, 17, 32)
global_average_pooling1d_6: (None, 32)
input_26: [(None, 1)]
concatenate_12: (None, 33)
dense_34: (None, 121)
dropout_21: (None, 121)
dense_35: (None, 23)
dense_36: (None, 217)
dense_37: (None, 1)
[I 2025-05-25 12:12:33,115] Trial 12 finished with value: 0.918154776096344 and parameters: {'embedding_dim': 103, 'n_conv_layers': 1, 'filters_0': 32, 'kernel_size_0': 3, 'activation_conv_0': 'selu', 'padding_0': 'valid', 'use_pooling_0': True, 'pool_size_0': 2, 'use_dropout_conv_0': False, 'global_pooling': 'avg', 'n_dense_layers': 3, 'dense_units_0': 121, 'activation_dense_0': 'elu', 'use_dropout_dense_0': True, 'dropout_rate_dense_0': 0.38370552437269456, 'dense_units_1': 23, 'activation_dense_1': 'relu', 'use_dropout_dense_1': False, 'dense_units_2': 217, 'activation_dense_2': 'relu', 'use_dropout_dense_2': False, 'optimizer': 'rmsprop', 'learning_rate': 0.002029082288113458, 'rho': 0.9880460441934611, 'loss': 'binary_crossentropy', 'batch_size': 32, 'patience': 5}. Best is trial 6 with value: 0.9241071343421936.
Layer shapes:
input_27: [(None, 37)]
embedding_13: (None, 37, 92)
conv1d_20: (None, 36, 128)
conv1d_21: (None, 33, 64)
global_max_pooling1d_6: (None, 64)
input_28: [(None, 1)]
concatenate_13: (None, 65)
dense_38: (None, 30)
dense_39: (None, 239)
dropout_22: (None, 239)
dense_40: (None, 38)
dense_41: (None, 1)
[I 2025-05-25 12:12:39,830] Trial 13 finished with value: 0.9084821343421936 and parameters: {'embedding_dim': 92, 'n_conv_layers': 2, 'filters_0': 128, 'kernel_size_0': 2, 'activation_conv_0': 'relu', 'padding_0': 'valid', 'use_pooling_0': False, 'use_dropout_conv_0': False, 'filters_1': 64, 'kernel_size_1': 4, 'activation_conv_1': 'elu', 'padding_1': 'valid', 'use_pooling_1': True, 'pool_size_1': 1, 'use_dropout_conv_1': False, 'global_pooling': 'max', 'n_dense_layers': 3, 'dense_units_0': 30, 'activation_dense_0': 'elu', 'use_dropout_dense_0': False, 'dense_units_1': 239, 'activation_dense_1': 'elu', 'use_dropout_dense_1': True, 'dropout_rate_dense_1': 0.14488471140350032, 'dense_units_2': 38, 'activation_dense_2': 'selu', 'use_dropout_dense_2': False, 'optimizer': 'rmsprop', 'learning_rate': 0.0018704526236114805, 'rho': 0.9355475172722483, 'loss': 'binary_crossentropy', 'batch_size': 64, 'patience': 10}. Best is trial 6 with value: 0.9241071343421936.
Layer shapes:
input_29: [(None, 37)]
embedding_14: (None, 37, 47)
conv1d_22: (None, 37, 32)
dropout_23: (None, 37, 32)
global_max_pooling1d_7: (None, 32)
input_30: [(None, 1)]
concatenate_14: (None, 33)
dense_42: (None, 89)
dropout_24: (None, 89)
dense_43: (None, 69)
dense_44: (None, 1)
[I 2025-05-25 12:12:45,123] Trial 14 finished with value: 0.918154776096344 and parameters: {'embedding_dim': 47, 'n_conv_layers': 1, 'filters_0': 32, 'kernel_size_0': 3, 'activation_conv_0': 'elu', 'padding_0': 'same', 'use_pooling_0': False, 'use_dropout_conv_0': True, 'dropout_rate_conv_0': 0.48972302429630876, 'global_pooling': 'max', 'n_dense_layers': 2, 'dense_units_0': 89, 'activation_dense_0': 'selu', 'use_dropout_dense_0': True, 'dropout_rate_dense_0': 0.34512969984306285, 'dense_units_1': 69, 'activation_dense_1': 'elu', 'use_dropout_dense_1': False, 'optimizer': 'rmsprop', 'learning_rate': 0.008901664912478008, 'rho': 0.9558451345384064, 'loss': 'binary_crossentropy', 'batch_size': 32, 'patience': 5}. Best is trial 6 with value: 0.9241071343421936.
Layer shapes:
input_31: [(None, 37)]
embedding_15: (None, 37, 89)
conv1d_23: (None, 36, 64)
conv1d_24: (None, 36, 32)
global_average_pooling1d_7: (None, 32)
input_32: [(None, 1)]
concatenate_15: (None, 33)
dense_45: (None, 146)
dense_46: (None, 68)
dropout_25: (None, 68)
dense_47: (None, 155)
dropout_26: (None, 155)
dense_48: (None, 1)
[I 2025-05-25 12:12:48,534] Trial 15 finished with value: 0.9166666865348816 and parameters: {'embedding_dim': 89, 'n_conv_layers': 2, 'filters_0': 64, 'kernel_size_0': 2, 'activation_conv_0': 'selu', 'padding_0': 'valid', 'use_pooling_0': True, 'pool_size_0': 1, 'use_dropout_conv_0': False, 'filters_1': 32, 'kernel_size_1': 4, 'activation_conv_1': 'selu', 'padding_1': 'same', 'use_pooling_1': False, 'use_dropout_conv_1': False, 'global_pooling': 'avg', 'n_dense_layers': 3, 'dense_units_0': 146, 'activation_dense_0': 'elu', 'use_dropout_dense_0': False, 'dense_units_1': 68, 'activation_dense_1': 'relu', 'use_dropout_dense_1': True, 'dropout_rate_dense_1': 0.4978573669018759, 'dense_units_2': 155, 'activation_dense_2': 'relu', 'use_dropout_dense_2': True, 'dropout_rate_dense_2': 0.11218984609179511, 'optimizer': 'rmsprop', 'learning_rate': 0.0039063135178884845, 'rho': 0.8907565830218264, 'loss': 'binary_crossentropy', 'batch_size': 64, 'patience': 3}. Best is trial 6 with value: 0.9241071343421936.
Layer shapes:
input_33: [(None, 37)]
embedding_16: (None, 37, 118)
conv1d_25: (None, 37, 32)
global_average_pooling1d_8: (None, 32)
input_34: [(None, 1)]
concatenate_16: (None, 33)
dense_49: (None, 68)
dropout_27: (None, 68)
dense_50: (None, 1)
[I 2025-05-25 12:12:51,196] Trial 16 finished with value: 0.9151785969734192 and parameters: {'embedding_dim': 118, 'n_conv_layers': 1, 'filters_0': 32, 'kernel_size_0': 3, 'activation_conv_0': 'relu', 'padding_0': 'same', 'use_pooling_0': False, 'use_dropout_conv_0': False, 'global_pooling': 'avg', 'n_dense_layers': 1, 'dense_units_0': 68, 'activation_dense_0': 'elu', 'use_dropout_dense_0': True, 'dropout_rate_dense_0': 0.4825100266754211, 'optimizer': 'adam', 'learning_rate': 0.0013876100216226345, 'beta1': 0.8018718220920654, 'beta2': 0.9908813634410146, 'loss': 'binary_crossentropy', 'batch_size': 128, 'patience': 9}. Best is trial 6 with value: 0.9241071343421936.
Layer shapes:
input_35: [(None, 37)]
embedding_17: (None, 37, 52)
conv1d_26: (None, 36, 64)
max_pooling1d_6: (None, 18, 64)
dropout_28: (None, 18, 64)
conv1d_27: (None, 16, 128)
max_pooling1d_7: (None, 8, 128)
dropout_29: (None, 8, 128)
conv1d_28: (None, 4, 32)
max_pooling1d_8: (None, 2, 32)
global_max_pooling1d_8: (None, 32)
input_36: [(None, 1)]
concatenate_17: (None, 33)
dense_51: (None, 184)
dense_52: (None, 252)
dense_53: (None, 1)
