[I 2025-05-25 13:18:05,138] Trial 39 finished with value: 0.5553287209142226 and parameters: {'penalty': 'l1', 'solver': 'liblinear', 'C': 3.6346566457989484e-05, 'tol': 0.0070751349600501855, 'fit_intercept': True, 'intercept_scaling': 6.663455275991324, 'max_iter': 605, 'class_weight': 'balanced'}. Best is trial 35 with value: 0.9111592309918135.
Error with parameters {'penalty': 'none', 'C': 0.12430634714155442, 'solver': 'saga', 'tol': 0.009983403587812571, 'fit_intercept': True, 'intercept_scaling': 4.486505516025687, 'max_iter': 432, 'class_weight': None, 'random_state': 42}: 
All the 5 fits failed.
It is very likely that your model is misconfigured.
You can try to debug the error by setting error_score='raise'.

Below are more details about the failures:
--------------------------------------------------------------------------------
5 fits failed with the following error:
Traceback (most recent call last):
  File "C:\Users\bakhtiyar\.conda\envs\myenv\lib\site-packages\sklearn\model_selection\_validation.py", line 888, in _fit_and_score
    estimator.fit(X_train, y_train, **fit_params)
  File "C:\Users\bakhtiyar\.conda\envs\myenv\lib\site-packages\sklearn\base.py", line 1473, in wrapper
    return fit_method(estimator, *args, **kwargs)
  File "C:\Users\bakhtiyar\.conda\envs\myenv\lib\site-packages\sklearn\pipeline.py", line 473, in fit
    self._final_estimator.fit(Xt, y, **last_step_params["fit"])
  File "C:\Users\bakhtiyar\.conda\envs\myenv\lib\site-packages\sklearn\base.py", line 1466, in wrapper
    estimator._validate_params()
  File "C:\Users\bakhtiyar\.conda\envs\myenv\lib\site-packages\sklearn\base.py", line 666, in _validate_params
    validate_parameter_constraints(
  File "C:\Users\bakhtiyar\.conda\envs\myenv\lib\site-packages\sklearn\utils\_param_validation.py", line 95, in validate_parameter_constraints
    raise InvalidParameterError(
sklearn.utils._param_validation.InvalidParameterError: The 'penalty' parameter of LogisticRegression must be a str among {'l2', 'elasticnet', 'l1'} or None. Got 'none' instead.

[I 2025-05-25 13:18:05,222] Trial 40 finished with value: -inf and parameters: {'penalty': 'none', 'solver': 'saga', 'C': 0.12430634714155442, 'tol': 0.009983403587812571, 'fit_intercept': True, 'intercept_scaling': 4.486505516025687, 'max_iter': 432, 'class_weight': None}. Best is trial 35 with value: 0.9111592309918135.
[I 2025-05-25 13:18:05,350] Trial 41 finished with value: 0.9111592309918135 and parameters: {'penalty': 'l2', 'solver': 'sag', 'C': 0.3654846875133254, 'tol': 0.0018870960977493897, 'fit_intercept': True, 'intercept_scaling': 5.158657119348136, 'max_iter': 813, 'class_weight': None}. Best is trial 35 with value: 0.9111592309918135.
[I 2025-05-25 13:18:05,470] Trial 42 finished with value: 0.9072879342003926 and parameters: {'penalty': 'l2', 'solver': 'lbfgs', 'C': 0.2999280665808951, 'tol': 0.004468658140813173, 'fit_intercept': True, 'intercept_scaling': 5.433128587447065, 'max_iter': 836, 'class_weight': None}. Best is trial 35 with value: 0.9111592309918135.
[I 2025-05-25 13:18:05,595] Trial 43 finished with value: 0.9111592309918135 and parameters: {'penalty': 'l2', 'solver': 'sag', 'C': 0.33680202355851757, 'tol': 0.0028147274436352244, 'fit_intercept': True, 'intercept_scaling': 4.835857537690095, 'max_iter': 987, 'class_weight': None}. Best is trial 35 with value: 0.9111592309918135.
[I 2025-05-25 13:18:05,711] Trial 44 finished with value: 0.9030852356121517 and parameters: {'penalty': 'l2', 'solver': 'liblinear', 'C': 0.049464063832094035, 'tol': 0.0016453594491596852, 'fit_intercept': True, 'intercept_scaling': 4.696123814243239, 'max_iter': 984, 'class_weight': None}. Best is trial 35 with value: 0.9111592309918135.
[I 2025-05-25 13:18:05,837] Trial 45 finished with value: 0.9111592309918135 and parameters: {'penalty': 'l2', 'solver': 'saga', 'C': 0.3544216877486785, 'tol': 0.0011153195858253954, 'fit_intercept': True, 'intercept_scaling': 3.8469788121286332, 'max_iter': 940, 'class_weight': None}. Best is trial 35 with value: 0.9111592309918135.
[I 2025-05-25 13:18:05,964] Trial 46 finished with value: 0.8970257378493587 and parameters: {'penalty': 'l1', 'solver': 'saga', 'C': 1.8253594149377277, 'tol': 0.00288603240042264, 'fit_intercept': True, 'intercept_scaling': 1.4249594809268062, 'max_iter': 941, 'class_weight': 'balanced'}. Best is trial 35 with value: 0.9111592309918135.
[I 2025-05-25 13:18:06,096] Trial 47 finished with value: 0.9039196955608558 and parameters: {'penalty': 'l2', 'solver': 'saga', 'C': 4.3107722055511815, 'tol': 0.001089523640231007, 'fit_intercept': True, 'intercept_scaling': 3.8935731479618605, 'max_iter': 889, 'class_weight': None}. Best is trial 35 with value: 0.9111592309918135.
[I 2025-05-25 13:18:06,219] Trial 48 finished with value: 0.880055486899656 and parameters: {'penalty': 'l2', 'solver': 'saga', 'C': 0.017414882127523325, 'tol': 0.0019500909357636654, 'fit_intercept': True, 'intercept_scaling': 2.6645542579712216, 'max_iter': 947, 'class_weight': None}. Best is trial 35 with value: 0.9111592309918135.
[I 2025-05-25 13:18:06,304] Trial 49 finished with value: -inf and parameters: {'penalty': 'none', 'solver': 'lbfgs', 'C': 0.3976550524654489, 'tol': 0.0011580211341678543, 'fit_intercept': True, 'intercept_scaling': 4.224959856362426, 'max_iter': 809, 'class_weight': None}. Best is trial 35 with value: 0.9111592309918135.
Error with parameters {'penalty': 'none', 'C': 0.3976550524654489, 'solver': 'lbfgs', 'tol': 0.0011580211341678543, 'fit_intercept': True, 'intercept_scaling': 4.224959856362426, 'max_iter': 809, 'class_weight': None, 'random_state': 42}: 
All the 5 fits failed.
It is very likely that your model is misconfigured.
You can try to debug the error by setting error_score='raise'.

Below are more details about the failures:
--------------------------------------------------------------------------------
5 fits failed with the following error:
Traceback (most recent call last):
  File "C:\Users\bakhtiyar\.conda\envs\myenv\lib\site-packages\sklearn\model_selection\_validation.py", line 888, in _fit_and_score
    estimator.fit(X_train, y_train, **fit_params)
  File "C:\Users\bakhtiyar\.conda\envs\myenv\lib\site-packages\sklearn\base.py", line 1473, in wrapper
    return fit_method(estimator, *args, **kwargs)
  File "C:\Users\bakhtiyar\.conda\envs\myenv\lib\site-packages\sklearn\pipeline.py", line 473, in fit
    self._final_estimator.fit(Xt, y, **last_step_params["fit"])
  File "C:\Users\bakhtiyar\.conda\envs\myenv\lib\site-packages\sklearn\base.py", line 1466, in wrapper
    estimator._validate_params()
  File "C:\Users\bakhtiyar\.conda\envs\myenv\lib\site-packages\sklearn\base.py", line 666, in _validate_params
    validate_parameter_constraints(
  File "C:\Users\bakhtiyar\.conda\envs\myenv\lib\site-packages\sklearn\utils\_param_validation.py", line 95, in validate_parameter_constraints
    raise InvalidParameterError(
sklearn.utils._param_validation.InvalidParameterError: The 'penalty' parameter of LogisticRegression must be a str among {'l2', 'elasticnet', 'l1'} or None. Got 'none' instead.

Best parameters: {'penalty': 'l2', 'solver': 'saga', 'C': 0.28582016195773047, 'tol': 0.005257356710178173, 'fit_intercept': True, 'intercept_scaling': 5.131115130404712, 'max_iter': 993, 'class_weight': None}
Best f1_weighted score: 0.9111592309918135
Accuracy: 0.925

Classification Report:
               precision    recall  f1-score   support

       False       0.93      0.95      0.94       130
        True       0.91      0.87      0.89        70

    accuracy                           0.93       200
   macro avg       0.92      0.91      0.92       200
weighted avg       0.92      0.93      0.92       200

Max RAM Usage: 0.78 MB
Training time: 0.0382 s
Inference time: 0.0046 s

Process finished with exit code 0
