[I 2025-05-25 12:12:55,367] Trial 17 finished with value: 0.9069940447807312 and parameters: {'embedding_dim': 52, 'n_conv_layers': 3, 'filters_0': 64, 'kernel_size_0': 2, 'activation_conv_0': 'selu', 'padding_0': 'valid', 'use_pooling_0': True, 'pool_size_0': 2, 'use_dropout_conv_0': True, 'dropout_rate_conv_0': 0.12522982437435176, 'filters_1': 128, 'kernel_size_1': 3, 'activation_conv_1': 'selu', 'padding_1': 'valid', 'use_pooling_1': True, 'pool_size_1': 2, 'use_dropout_conv_1': True, 'dropout_rate_conv_1': 0.4908750157023238, 'filters_2': 32, 'kernel_size_2': 5, 'activation_conv_2': 'elu', 'padding_2': 'valid', 'use_pooling_2': True, 'pool_size_2': 2, 'use_dropout_conv_2': False, 'global_pooling': 'max', 'n_dense_layers': 2, 'dense_units_0': 184, 'activation_dense_0': 'elu', 'use_dropout_dense_0': False, 'dense_units_1': 252, 'activation_dense_1': 'selu', 'use_dropout_dense_1': False, 'optimizer': 'rmsprop', 'learning_rate': 0.003615807143572801, 'rho': 0.9606457150197286, 'loss': 'binary_crossentropy', 'batch_size': 128, 'patience': 6}. Best is trial 6 with value: 0.9241071343421936.
Layer shapes:
input_37: [(None, 37)]
embedding_18: (None, 37, 87)
conv1d_29: (None, 37, 128)
dropout_30: (None, 37, 128)
conv1d_30: (None, 33, 128)
dropout_31: (None, 33, 128)
global_average_pooling1d_9: (None, 128)
input_38: [(None, 1)]
concatenate_18: (None, 129)
dense_54: (None, 107)
dropout_32: (None, 107)
dense_55: (None, 1)
[I 2025-05-25 12:13:07,179] Trial 18 finished with value: 0.921875 and parameters: {'embedding_dim': 87, 'n_conv_layers': 2, 'filters_0': 128, 'kernel_size_0': 3, 'activation_conv_0': 'relu', 'padding_0': 'same', 'use_pooling_0': True, 'pool_size_0': 1, 'use_dropout_conv_0': True, 'dropout_rate_conv_0': 0.4006325345632594, 'filters_1': 128, 'kernel_size_1': 5, 'activation_conv_1': 'elu', 'padding_1': 'valid', 'use_pooling_1': False, 'use_dropout_conv_1': True, 'dropout_rate_conv_1': 0.12050633697784202, 'global_pooling': 'avg', 'n_dense_layers': 1, 'dense_units_0': 107, 'activation_dense_0': 'relu', 'use_dropout_dense_0': True, 'dropout_rate_dense_0': 0.2713264834586006, 'optimizer': 'rmsprop', 'learning_rate': 0.0004495443428339483, 'rho': 0.9023795697534391, 'loss': 'binary_crossentropy', 'batch_size': 64, 'patience': 4}. Best is trial 6 with value: 0.9241071343421936.
Layer shapes:
input_39: [(None, 37)]
embedding_19: (None, 37, 87)
conv1d_31: (None, 37, 128)
dropout_33: (None, 37, 128)
conv1d_32: (None, 33, 128)
dropout_34: (None, 33, 128)
global_max_pooling1d_9: (None, 128)
input_40: [(None, 1)]
concatenate_19: (None, 129)
dense_56: (None, 52)
dense_57: (None, 1)
[I 2025-05-25 12:13:15,657] Trial 19 finished with value: 0.9040178656578064 and parameters: {'embedding_dim': 87, 'n_conv_layers': 2, 'filters_0': 128, 'kernel_size_0': 4, 'activation_conv_0': 'elu', 'padding_0': 'same', 'use_pooling_0': False, 'use_dropout_conv_0': True, 'dropout_rate_conv_0': 0.40321800386010753, 'filters_1': 128, 'kernel_size_1': 5, 'activation_conv_1': 'elu', 'padding_1': 'valid', 'use_pooling_1': False, 'use_dropout_conv_1': True, 'dropout_rate_conv_1': 0.11456739623615923, 'global_pooling': 'max', 'n_dense_layers': 1, 'dense_units_0': 52, 'activation_dense_0': 'relu', 'use_dropout_dense_0': False, 'optimizer': 'adam', 'learning_rate': 0.0005252404320804765, 'beta1': 0.8002225118233941, 'beta2': 0.8028888613549252, 'loss': 'binary_crossentropy', 'batch_size': 64, 'patience': 4}. Best is trial 6 with value: 0.9241071343421936.
Layer shapes:
input_41: [(None, 37)]
embedding_20: (None, 37, 104)
conv1d_33: (None, 37, 128)
dropout_35: (None, 37, 128)
conv1d_34: (None, 34, 128)
dropout_36: (None, 34, 128)
conv1d_35: (None, 34, 256)
global_max_pooling1d_10: (None, 256)
input_42: [(None, 1)]
concatenate_20: (None, 257)
dense_58: (None, 105)
dense_59: (None, 1)
[I 2025-05-25 12:13:34,475] Trial 20 finished with value: 0.9092261791229248 and parameters: {'embedding_dim': 104, 'n_conv_layers': 3, 'filters_0': 128, 'kernel_size_0': 3, 'activation_conv_0': 'selu', 'padding_0': 'same', 'use_pooling_0': True, 'pool_size_0': 1, 'use_dropout_conv_0': True, 'dropout_rate_conv_0': 0.32379077683201085, 'filters_1': 128, 'kernel_size_1': 4, 'activation_conv_1': 'elu', 'padding_1': 'valid', 'use_pooling_1': False, 'use_dropout_conv_1': True, 'dropout_rate_conv_1': 0.11895773869075882, 'filters_2': 256, 'kernel_size_2': 5, 'activation_conv_2': 'elu', 'padding_2': 'same', 'use_pooling_2': False, 'use_dropout_conv_2': False, 'global_pooling': 'max', 'n_dense_layers': 1, 'dense_units_0': 105, 'activation_dense_0': 'relu', 'use_dropout_dense_0': False, 'optimizer': 'rmsprop', 'learning_rate': 0.00040728772528506865, 'rho': 0.8937355490754302, 'loss': 'binary_crossentropy', 'batch_size': 64, 'patience': 4}. Best is trial 6 with value: 0.9241071343421936.
Layer shapes:
input_43: [(None, 37)]
embedding_21: (None, 37, 84)
conv1d_36: (None, 37, 128)
dropout_37: (None, 37, 128)
conv1d_37: (None, 33, 128)
dropout_38: (None, 33, 128)
global_average_pooling1d_10: (None, 128)
input_44: [(None, 1)]
concatenate_21: (None, 129)
dense_60: (None, 161)
dropout_39: (None, 161)
dense_61: (None, 1)
[I 2025-05-25 12:13:47,496] Trial 21 finished with value: 0.9233630895614624 and parameters: {'embedding_dim': 84, 'n_conv_layers': 2, 'filters_0': 128, 'kernel_size_0': 3, 'activation_conv_0': 'relu', 'padding_0': 'same', 'use_pooling_0': True, 'pool_size_0': 1, 'use_dropout_conv_0': True, 'dropout_rate_conv_0': 0.4167145582147226, 'filters_1': 128, 'kernel_size_1': 5, 'activation_conv_1': 'elu', 'padding_1': 'valid', 'use_pooling_1': False, 'use_dropout_conv_1': True, 'dropout_rate_conv_1': 0.22670805395134522, 'global_pooling': 'avg', 'n_dense_layers': 1, 'dense_units_0': 161, 'activation_dense_0': 'relu', 'use_dropout_dense_0': True, 'dropout_rate_dense_0': 0.27204981611517826, 'optimizer': 'rmsprop', 'learning_rate': 0.007036041972388759, 'rho': 0.9689610341588955, 'loss': 'binary_crossentropy', 'batch_size': 64, 'patience': 6}. Best is trial 6 with value: 0.9241071343421936.
Layer shapes:
input_45: [(None, 37)]
embedding_22: (None, 37, 82)
conv1d_38: (None, 37, 128)
dropout_40: (None, 37, 128)
conv1d_39: (None, 33, 128)
dropout_41: (None, 33, 128)
global_average_pooling1d_11: (None, 128)
input_46: [(None, 1)]
concatenate_22: (None, 129)
dense_62: (None, 103)
dropout_42: (None, 103)
dense_63: (None, 1)
[I 2025-05-25 12:13:58,271] Trial 22 finished with value: 0.9196428656578064 and parameters: {'embedding_dim': 82, 'n_conv_layers': 2, 'filters_0': 128, 'kernel_size_0': 3, 'activation_conv_0': 'relu', 'padding_0': 'same', 'use_pooling_0': True, 'pool_size_0': 1, 'use_dropout_conv_0': True, 'dropout_rate_conv_0': 0.4107396439574258, 'filters_1': 128, 'kernel_size_1': 5, 'activation_conv_1': 'elu', 'padding_1': 'valid', 'use_pooling_1': False, 'use_dropout_conv_1': True, 'dropout_rate_conv_1': 0.22640044415273558, 'global_pooling': 'avg', 'n_dense_layers': 1, 'dense_units_0': 103, 'activation_dense_0': 'relu', 'use_dropout_dense_0': True, 'dropout_rate_dense_0': 0.25801462021267296, 'optimizer': 'rmsprop', 'learning_rate': 0.006771360684988685, 'rho': 0.9224830751083386, 'loss': 'binary_crossentropy', 'batch_size': 64, 'patience': 6}. Best is trial 6 with value: 0.9241071343421936.
Layer shapes:
input_47: [(None, 37)]
embedding_23: (None, 37, 97)
conv1d_40: (None, 37, 128)
dropout_43: (None, 37, 128)
conv1d_41: (None, 33, 128)
dropout_44: (None, 33, 128)
global_average_pooling1d_12: (None, 128)
input_48: [(None, 1)]
concatenate_23: (None, 129)
dense_64: (None, 133)
dropout_45: (None, 133)
dense_65: (None, 1)
[I 2025-05-25 12:14:03,934] Trial 23 finished with value: 0.9211309552192688 and parameters: {'embedding_dim': 97, 'n_conv_layers': 2, 'filters_0': 128, 'kernel_size_0': 3, 'activation_conv_0': 'relu', 'padding_0': 'same', 'use_pooling_0': True, 'pool_size_0': 1, 'use_dropout_conv_0': True, 'dropout_rate_conv_0': 0.4172565607419, 'filters_1': 128, 'kernel_size_1': 5, 'activation_conv_1': 'elu', 'padding_1': 'valid', 'use_pooling_1': False, 'use_dropout_conv_1': True, 'dropout_rate_conv_1': 0.21003483668285639, 'global_pooling': 'avg', 'n_dense_layers': 1, 'dense_units_0': 133, 'activation_dense_0': 'relu', 'use_dropout_dense_0': True, 'dropout_rate_dense_0': 0.29766345465970934, 'optimizer': 'rmsprop', 'learning_rate': 0.001346938973149907, 'rho': 0.8619248384015982, 'loss': 'binary_crossentropy', 'batch_size': 64, 'patience': 3}. Best is trial 6 with value: 0.9241071343421936.
Layer shapes:
input_49: [(None, 37)]
embedding_24: (None, 37, 112)
conv1d_42: (None, 37, 128)
dropout_46: (None, 37, 128)
conv1d_43: (None, 34, 128)
dropout_47: (None, 34, 128)
global_average_pooling1d_13: (None, 128)
input_50: [(None, 1)]
concatenate_24: (None, 129)
dense_66: (None, 159)
dropout_48: (None, 159)
dense_67: (None, 1)
[I 2025-05-25 12:14:08,212] Trial 24 finished with value: 0.9114583134651184 and parameters: {'embedding_dim': 112, 'n_conv_layers': 2, 'filters_0': 128, 'kernel_size_0': 4, 'activation_conv_0': 'relu', 'padding_0': 'same', 'use_pooling_0': True, 'pool_size_0': 1, 'use_dropout_conv_0': True, 'dropout_rate_conv_0': 0.4911003487540825, 'filters_1': 128, 'kernel_size_1': 4, 'activation_conv_1': 'elu', 'padding_1': 'valid', 'use_pooling_1': False, 'use_dropout_conv_1': True, 'dropout_rate_conv_1': 0.16907045883517566, 'global_pooling': 'avg', 'n_dense_layers': 1, 'dense_units_0': 159, 'activation_dense_0': 'relu', 'use_dropout_dense_0': True, 'dropout_rate_dense_0': 0.20936964729692384, 'optimizer': 'rmsprop', 'learning_rate': 0.0004796725972662598, 'rho': 0.9729011655060815, 'loss': 'binary_crossentropy', 'batch_size': 64, 'patience': 4}. Best is trial 6 with value: 0.9241071343421936.
Layer shapes:
input_51: [(None, 37)]
embedding_25: (None, 37, 81)
conv1d_44: (None, 37, 128)
dropout_49: (None, 37, 128)
conv1d_45: (None, 33, 128)
dropout_50: (None, 33, 128)
conv1d_46: (None, 33, 256)
global_average_pooling1d_14: (None, 256)
input_52: [(None, 1)]
concatenate_25: (None, 257)
dense_68: (None, 47)
dropout_51: (None, 47)
dense_69: (None, 1)
[I 2025-05-25 12:14:24,526] Trial 25 finished with value: 0.9159226417541504 and parameters: {'embedding_dim': 81, 'n_conv_layers': 3, 'filters_0': 128, 'kernel_size_0': 3, 'activation_conv_0': 'relu', 'padding_0': 'same', 'use_pooling_0': True, 'pool_size_0': 1, 'use_dropout_conv_0': True, 'dropout_rate_conv_0': 0.3786237046237001, 'filters_1': 128, 'kernel_size_1': 5, 'activation_conv_1': 'elu', 'padding_1': 'valid', 'use_pooling_1': False, 'use_dropout_conv_1': True, 'dropout_rate_conv_1': 0.25673815087696605, 'filters_2': 256, 'kernel_size_2': 2, 'activation_conv_2': 'selu', 'padding_2': 'same', 'use_pooling_2': True, 'pool_size_2': 1, 'use_dropout_conv_2': False, 'global_pooling': 'avg', 'n_dense_layers': 1, 'dense_units_0': 47, 'activation_dense_0': 'relu', 'use_dropout_dense_0': True, 'dropout_rate_dense_0': 0.3371286417239353, 'optimizer': 'rmsprop', 'learning_rate': 0.006874473953785699, 'rho': 0.9316301386677273, 'loss': 'binary_crossentropy', 'batch_size': 64, 'patience': 5}. Best is trial 6 with value: 0.9241071343421936.
Layer shapes:
input_53: [(None, 37)]
embedding_26: (None, 37, 97)
conv1d_47: (None, 37, 32)
dropout_52: (None, 37, 32)
conv1d_48: (None, 35, 256)
dropout_53: (None, 35, 256)
global_average_pooling1d_15: (None, 256)
input_54: [(None, 1)]
concatenate_26: (None, 257)
dense_70: (None, 114)
dropout_54: (None, 114)
dense_71: (None, 1)
[I 2025-05-25 12:14:30,694] Trial 26 finished with value: 0.9203869104385376 and parameters: {'embedding_dim': 97, 'n_conv_layers': 2, 'filters_0': 32, 'kernel_size_0': 4, 'activation_conv_0': 'relu', 'padding_0': 'same', 'use_pooling_0': False, 'use_dropout_conv_0': True, 'dropout_rate_conv_0': 0.3085525417431737, 'filters_1': 256, 'kernel_size_1': 3, 'activation_conv_1': 'elu', 'padding_1': 'valid', 'use_pooling_1': False, 'use_dropout_conv_1': True, 'dropout_rate_conv_1': 0.3894555076631222, 'global_pooling': 'avg', 'n_dense_layers': 1, 'dense_units_0': 114, 'activation_dense_0': 'relu', 'use_dropout_dense_0': True, 'dropout_rate_dense_0': 0.11187129305699123, 'optimizer': 'rmsprop', 'learning_rate': 0.005144972208009857, 'rho': 0.8656299433077399, 'loss': 'binary_crossentropy', 'batch_size': 32, 'patience': 6}. Best is trial 6 with value: 0.9241071343421936.
Layer shapes:
input_55: [(None, 37)]
embedding_27: (None, 37, 59)
conv1d_49: (None, 37, 128)
dropout_55: (None, 37, 128)
conv1d_50: (None, 34, 32)
dropout_56: (None, 34, 32)
global_average_pooling1d_16: (None, 32)
input_56: [(None, 1)]
concatenate_27: (None, 33)
dense_72: (None, 81)
dropout_57: (None, 81)
dense_73: (None, 210)
dropout_58: (None, 210)
dense_74: (None, 1)
[I 2025-05-25 12:14:36,028] Trial 27 finished with value: 0.9122023582458496 and parameters: {'embedding_dim': 59, 'n_conv_layers': 2, 'filters_0': 128, 'kernel_size_0': 3, 'activation_conv_0': 'relu', 'padding_0': 'same', 'use_pooling_0': True, 'pool_size_0': 1, 'use_dropout_conv_0': True, 'dropout_rate_conv_0': 0.3458640152751392, 'filters_1': 32, 'kernel_size_1': 4, 'activation_conv_1': 'elu', 'padding_1': 'valid', 'use_pooling_1': False, 'use_dropout_conv_1': True, 'dropout_rate_conv_1': 0.15269151047134127, 'global_pooling': 'avg', 'n_dense_layers': 2, 'dense_units_0': 81, 'activation_dense_0': 'selu', 'use_dropout_dense_0': True, 'dropout_rate_dense_0': 0.24994688463500989, 'dense_units_1': 210, 'activation_dense_1': 'selu', 'use_dropout_dense_1': True, 'dropout_rate_dense_1': 0.10976424409542712, 'optimizer': 'rmsprop', 'learning_rate': 0.000219495679717578, 'rho': 0.9487190986071073, 'loss': 'binary_crossentropy', 'batch_size': 64, 'patience': 4}. Best is trial 6 with value: 0.9241071343421936.
Layer shapes:
input_57: [(None, 37)]
embedding_28: (None, 37, 128)
conv1d_51: (None, 37, 128)
dropout_59: (None, 37, 128)
conv1d_52: (None, 37, 64)
max_pooling1d_9: (None, 18, 64)
conv1d_53: (None, 15, 64)
dropout_60: (None, 15, 64)
global_max_pooling1d_11: (None, 64)
input_58: [(None, 1)]
concatenate_28: (None, 65)
dense_75: (None, 53)
dense_76: (None, 1)
[I 2025-05-25 12:14:44,073] Trial 28 finished with value: 0.613095223903656 and parameters: {'embedding_dim': 128, 'n_conv_layers': 3, 'filters_0': 128, 'kernel_size_0': 3, 'activation_conv_0': 'elu', 'padding_0': 'same', 'use_pooling_0': False, 'use_dropout_conv_0': True, 'dropout_rate_conv_0': 0.23355371799988728, 'filters_1': 64, 'kernel_size_1': 5, 'activation_conv_1': 'selu', 'padding_1': 'same', 'use_pooling_1': True, 'pool_size_1': 2, 'use_dropout_conv_1': False, 'filters_2': 64, 'kernel_size_2': 4, 'activation_conv_2': 'relu', 'padding_2': 'valid', 'use_pooling_2': False, 'use_dropout_conv_2': True, 'dropout_rate_conv_2': 0.49572041089944524, 'global_pooling': 'max', 'n_dense_layers': 1, 'dense_units_0': 53, 'activation_dense_0': 'relu', 'use_dropout_dense_0': False, 'optimizer': 'sgd', 'learning_rate': 0.0007120624568651971, 'momentum': 0.003142555673013192, 'loss': 'binary_crossentropy', 'batch_size': 64, 'patience': 5}. Best is trial 6 with value: 0.9241071343421936.
Layer shapes:
input_59: [(None, 37)]
embedding_29: (None, 37, 80)
conv1d_54: (None, 37, 32)
dropout_61: (None, 37, 32)
conv1d_55: (None, 34, 128)
dropout_62: (None, 34, 128)
conv1d_56: (None, 33, 128)
max_pooling1d_10: (None, 16, 128)
dropout_63: (None, 16, 128)
global_max_pooling1d_12: (None, 128)
input_60: [(None, 1)]
concatenate_29: (None, 129)
dense_77: (None, 146)
dropout_64: (None, 146)
dense_78: (None, 1)
Best trial:
  Value: 0.9241071343421936
  Params:
    embedding_dim: 103
    n_conv_layers: 1
    filters_0: 32
    kernel_size_0: 3
    activation_conv_0: selu
    padding_0: same
    use_pooling_0: False
    use_dropout_conv_0: True
    dropout_rate_conv_0: 0.3428218350065193
    global_pooling: max
    n_dense_layers: 1
    dense_units_0: 63
    activation_dense_0: elu
    use_dropout_dense_0: False
    optimizer: rmsprop
    learning_rate: 0.006182179787065901
    rho: 0.9875986793844692
    loss: binary_crossentropy
    batch_size: 64
    patience: 4
[I 2025-05-25 12:14:53,961] Trial 29 finished with value: 0.8891369104385376 and parameters: {'embedding_dim': 80, 'n_conv_layers': 3, 'filters_0': 32, 'kernel_size_0': 4, 'activation_conv_0': 'selu', 'padding_0': 'same', 'use_pooling_0': True, 'pool_size_0': 1, 'use_dropout_conv_0': True, 'dropout_rate_conv_0': 0.4268630074933596, 'filters_1': 128, 'kernel_size_1': 4, 'activation_conv_1': 'relu', 'padding_1': 'valid', 'use_pooling_1': False, 'use_dropout_conv_1': True, 'dropout_rate_conv_1': 0.2573623152060157, 'filters_2': 128, 'kernel_size_2': 2, 'activation_conv_2': 'relu', 'padding_2': 'valid', 'use_pooling_2': True, 'pool_size_2': 2, 'use_dropout_conv_2': True, 'dropout_rate_conv_2': 0.43437805853243006, 'global_pooling': 'max', 'n_dense_layers': 1, 'dense_units_0': 146, 'activation_dense_0': 'relu', 'use_dropout_dense_0': True, 'dropout_rate_dense_0': 0.31467813513824594, 'optimizer': 'adam', 'learning_rate': 0.001134657858113952, 'beta1': 0.9667340068552782, 'beta2': 0.8929837671306644, 'loss': 'binary_focal_loss', 'focal_loss_gamma': 1.0139443876333822, 'focal_loss_alpha': 0.36489994310736484, 'batch_size': 64, 'patience': 8}. Best is trial 6 with value: 0.9241071343421936.
Epoch 1/50
95/95 [==============================] - 2s 7ms/step - loss: 0.3652 - accuracy: 0.8527 - val_loss: 0.2758 - val_accuracy: 0.8943
Epoch 2/50
95/95 [==============================] - 0s 3ms/step - loss: 0.2629 - accuracy: 0.8967 - val_loss: 0.2632 - val_accuracy: 0.8929
Epoch 3/50
95/95 [==============================] - 0s 4ms/step - loss: 0.2423 - accuracy: 0.9081 - val_loss: 0.2622 - val_accuracy: 0.8943
Epoch 4/50
95/95 [==============================] - 0s 3ms/step - loss: 0.2281 - accuracy: 0.9139 - val_loss: 0.2905 - val_accuracy: 0.9003
Epoch 5/50
95/95 [==============================] - 0s 3ms/step - loss: 0.2110 - accuracy: 0.9206 - val_loss: 0.2505 - val_accuracy: 0.9048
Epoch 6/50
95/95 [==============================] - 0s 3ms/step - loss: 0.2123 - accuracy: 0.9216 - val_loss: 0.2275 - val_accuracy: 0.9152
Epoch 7/50
95/95 [==============================] - 0s 3ms/step - loss: 0.1964 - accuracy: 0.9258 - val_loss: 0.2339 - val_accuracy: 0.9226
Epoch 8/50
95/95 [==============================] - 0s 3ms/step - loss: 0.1922 - accuracy: 0.9254 - val_loss: 0.2577 - val_accuracy: 0.9092
Epoch 9/50
95/95 [==============================] - 0s 3ms/step - loss: 0.1852 - accuracy: 0.9281 - val_loss: 0.2707 - val_accuracy: 0.9137
Epoch 10/50
95/95 [==============================] - 0s 3ms/step - loss: 0.1820 - accuracy: 0.9291 - val_loss: 0.2353 - val_accuracy: 0.9256
Epoch 11/50
95/95 [==============================] - 0s 3ms/step - loss: 0.1746 - accuracy: 0.9297 - val_loss: 0.2534 - val_accuracy: 0.9107
Epoch 12/50
95/95 [==============================] - 0s 3ms/step - loss: 0.1734 - accuracy: 0.9349 - val_loss: 0.2401 - val_accuracy: 0.9092
Epoch 13/50
95/95 [==============================] - 0s 3ms/step - loss: 0.1671 - accuracy: 0.9370 - val_loss: 0.2366 - val_accuracy: 0.9107
Epoch 14/50
95/95 [==============================] - 0s 3ms/step - loss: 0.1650 - accuracy: 0.9342 - val_loss: 0.2394 - val_accuracy: 0.9256
53/53 [==============================] - 0s 798us/step
              precision    recall  f1-score   support

       False       0.89      0.96      0.93      1012
        True       0.93      0.83      0.88       668

    accuracy                           0.91      1680
   macro avg       0.91      0.89      0.90      1680
weighted avg       0.91      0.91      0.91      1680

Max RAM Usage: 5.22 MB
Training time: 6.1323 s
Inference time: 0.2251 s

Process finished with exit code 0
