[I 2025-05-24 19:50:18,853] Trial 47 finished with value: 0.9217948717948719 and parameters: {'penalty': None, 'C': 0.14836602986913733, 'solver': 'sag', 'max_iter': 605, 'tol': 4.022485471351681e-05, 'fit_intercept': False, 'class_weight': None}. Best is trial 0 with value: 0.9371794871794872.
[I 2025-05-24 19:50:18,970] Trial 48 finished with value: 0.9371794871794872 and parameters: {'penalty': 'l2', 'C': 0.45291165552807594, 'solver': 'saga', 'max_iter': 405, 'tol': 8.557208315603378e-05, 'fit_intercept': False, 'class_weight': 'balanced'}. Best is trial 0 with value: 0.9371794871794872.
C:\Users\bakhtiyar\.conda\envs\myenv\lib\site-packages\sklearn\linear_model\_logistic.py:1208: UserWarning: Setting penalty=None will ignore the C and l1_ratio parameters
  warnings.warn(
C:\Users\bakhtiyar\.conda\envs\myenv\lib\site-packages\sklearn\linear_model\_logistic.py:1208: UserWarning: Setting penalty=None will ignore the C and l1_ratio parameters
  warnings.warn(
C:\Users\bakhtiyar\.conda\envs\myenv\lib\site-packages\sklearn\linear_model\_logistic.py:1208: UserWarning: Setting penalty=None will ignore the C and l1_ratio parameters
  warnings.warn(
C:\Users\bakhtiyar\.conda\envs\myenv\lib\site-packages\sklearn\linear_model\_logistic.py:1208: UserWarning: Setting penalty=None will ignore the C and l1_ratio parameters
  warnings.warn(
C:\Users\bakhtiyar\.conda\envs\myenv\lib\site-packages\sklearn\linear_model\_logistic.py:1208: UserWarning: Setting penalty=None will ignore the C and l1_ratio parameters
  warnings.warn(
[I 2025-05-24 19:50:19,083] Trial 49 finished with value: 0.9217948717948719 and parameters: {'penalty': None, 'C': 4.1307803884452285, 'solver': 'lbfgs', 'max_iter': 687, 'tol': 0.00011586450295036204, 'fit_intercept': False, 'class_weight': None}. Best is trial 0 with value: 0.9371794871794872.
Best trial: 0
Best accuracy: 0.9372
Best hyperparameters:
    penalty: l2
    C: 0.5734832745724739
    solver: lbfgs
    max_iter: 589
    tol: 4.1447041401072306e-05
    fit_intercept: False
    class_weight: balanced

Обучение модели с оптимальными параметрами...

Результаты оптимизированной модели:
              precision    recall  f1-score   support

           0       0.73      0.80      0.76        10
           1       0.60      0.50      0.55         6

    accuracy                           0.69        16
   macro avg       0.66      0.65      0.65        16
weighted avg       0.68      0.69      0.68        16

Max RAM Usage: 0.78 MB
Training time: 0.1477 s
Inference time: 0.0160 s

Process finished with exit code 0
