[I 2025-05-24 19:50:16,313] Trial 28 finished with value: 0.9371794871794872 and parameters: {'penalty': 'l2', 'C': 2.4987992619029264, 'solver': 'newton-cg', 'max_iter': 1989, 'tol': 4.796804661815437e-06, 'fit_intercept': True, 'class_weight': 'balanced'}. Best is trial 0 with value: 0.9371794871794872.
C:\Users\bakhtiyar\.conda\envs\myenv\lib\site-packages\sklearn\linear_model\_sag.py:349: ConvergenceWarning: The max_iter was reached which means the coef_ did not converge
  warnings.warn(
C:\Users\bakhtiyar\.conda\envs\myenv\lib\site-packages\sklearn\linear_model\_sag.py:349: ConvergenceWarning: The max_iter was reached which means the coef_ did not converge
  warnings.warn(
C:\Users\bakhtiyar\.conda\envs\myenv\lib\site-packages\sklearn\linear_model\_sag.py:349: ConvergenceWarning: The max_iter was reached which means the coef_ did not converge
  warnings.warn(
C:\Users\bakhtiyar\.conda\envs\myenv\lib\site-packages\sklearn\linear_model\_sag.py:349: ConvergenceWarning: The max_iter was reached which means the coef_ did not converge
  warnings.warn(
C:\Users\bakhtiyar\.conda\envs\myenv\lib\site-packages\sklearn\linear_model\_sag.py:349: ConvergenceWarning: The max_iter was reached which means the coef_ did not converge
  warnings.warn(
[I 2025-05-24 19:50:16,435] Trial 29 finished with value: 0.9371794871794872 and parameters: {'penalty': 'elasticnet', 'C': 17.898849354484803, 'solver': 'lbfgs', 'max_iter': 143, 'tol': 2.3230526991478584e-06, 'fit_intercept': False, 'class_weight': None, 'l1_ratio': 0.5365509533433865}. Best is trial 0 with value: 0.9371794871794872.
C:\Users\bakhtiyar\.conda\envs\myenv\lib\site-packages\sklearn\linear_model\_logistic.py:1208: UserWarning: Setting penalty=None will ignore the C and l1_ratio parameters
  warnings.warn(
C:\Users\bakhtiyar\.conda\envs\myenv\lib\site-packages\sklearn\linear_model\_logistic.py:1208: UserWarning: Setting penalty=None will ignore the C and l1_ratio parameters
  warnings.warn(
C:\Users\bakhtiyar\.conda\envs\myenv\lib\site-packages\sklearn\linear_model\_logistic.py:1208: UserWarning: Setting penalty=None will ignore the C and l1_ratio parameters
  warnings.warn(
C:\Users\bakhtiyar\.conda\envs\myenv\lib\site-packages\sklearn\linear_model\_logistic.py:1208: UserWarning: Setting penalty=None will ignore the C and l1_ratio parameters
  warnings.warn(
C:\Users\bakhtiyar\.conda\envs\myenv\lib\site-packages\sklearn\linear_model\_logistic.py:1208: UserWarning: Setting penalty=None will ignore the C and l1_ratio parameters
  warnings.warn(
[I 2025-05-24 19:50:16,535] Trial 30 finished with value: 0.9217948717948719 and parameters: {'penalty': None, 'C': 1.1474877802398182, 'solver': 'lbfgs', 'max_iter': 1668, 'tol': 5.980296952439397e-05, 'fit_intercept': False, 'class_weight': None}. Best is trial 0 with value: 0.9371794871794872.
C:\Users\bakhtiyar\.conda\envs\myenv\lib\site-packages\sklearn\linear_model\_logistic.py:1208: UserWarning: Setting penalty=None will ignore the C and l1_ratio parameters
  warnings.warn(
C:\Users\bakhtiyar\.conda\envs\myenv\lib\site-packages\sklearn\linear_model\_sag.py:349: ConvergenceWarning: The max_iter was reached which means the coef_ did not converge
  warnings.warn(
C:\Users\bakhtiyar\.conda\envs\myenv\lib\site-packages\sklearn\linear_model\_logistic.py:1208: UserWarning: Setting penalty=None will ignore the C and l1_ratio parameters
  warnings.warn(
C:\Users\bakhtiyar\.conda\envs\myenv\lib\site-packages\sklearn\linear_model\_sag.py:349: ConvergenceWarning: The max_iter was reached which means the coef_ did not converge
  warnings.warn(
C:\Users\bakhtiyar\.conda\envs\myenv\lib\site-packages\sklearn\linear_model\_logistic.py:1208: UserWarning: Setting penalty=None will ignore the C and l1_ratio parameters
  warnings.warn(
C:\Users\bakhtiyar\.conda\envs\myenv\lib\site-packages\sklearn\linear_model\_sag.py:349: ConvergenceWarning: The max_iter was reached which means the coef_ did not converge
  warnings.warn(
C:\Users\bakhtiyar\.conda\envs\myenv\lib\site-packages\sklearn\linear_model\_logistic.py:1208: UserWarning: Setting penalty=None will ignore the C and l1_ratio parameters
  warnings.warn(
C:\Users\bakhtiyar\.conda\envs\myenv\lib\site-packages\sklearn\linear_model\_sag.py:349: ConvergenceWarning: The max_iter was reached which means the coef_ did not converge
  warnings.warn(
C:\Users\bakhtiyar\.conda\envs\myenv\lib\site-packages\sklearn\linear_model\_logistic.py:1208: UserWarning: Setting penalty=None will ignore the C and l1_ratio parameters
  warnings.warn(
C:\Users\bakhtiyar\.conda\envs\myenv\lib\site-packages\sklearn\linear_model\_sag.py:349: ConvergenceWarning: The max_iter was reached which means the coef_ did not converge
  warnings.warn(
[I 2025-05-24 19:50:16,646] Trial 31 finished with value: 0.9371794871794872 and parameters: {'penalty': None, 'C': 40.162730494826526, 'solver': 'saga', 'max_iter': 126, 'tol': 4.267533213118722e-05, 'fit_intercept': False, 'class_weight': None}. Best is trial 0 with value: 0.9371794871794872.
C:\Users\bakhtiyar\.conda\envs\myenv\lib\site-packages\sklearn\linear_model\_logistic.py:1208: UserWarning: Setting penalty=None will ignore the C and l1_ratio parameters
  warnings.warn(
C:\Users\bakhtiyar\.conda\envs\myenv\lib\site-packages\sklearn\linear_model\_sag.py:349: ConvergenceWarning: The max_iter was reached which means the coef_ did not converge
  warnings.warn(
C:\Users\bakhtiyar\.conda\envs\myenv\lib\site-packages\sklearn\linear_model\_logistic.py:1208: UserWarning: Setting penalty=None will ignore the C and l1_ratio parameters
  warnings.warn(
C:\Users\bakhtiyar\.conda\envs\myenv\lib\site-packages\sklearn\linear_model\_sag.py:349: ConvergenceWarning: The max_iter was reached which means the coef_ did not converge
  warnings.warn(
C:\Users\bakhtiyar\.conda\envs\myenv\lib\site-packages\sklearn\linear_model\_logistic.py:1208: UserWarning: Setting penalty=None will ignore the C and l1_ratio parameters
  warnings.warn(
C:\Users\bakhtiyar\.conda\envs\myenv\lib\site-packages\sklearn\linear_model\_sag.py:349: ConvergenceWarning: The max_iter was reached which means the coef_ did not converge
  warnings.warn(
C:\Users\bakhtiyar\.conda\envs\myenv\lib\site-packages\sklearn\linear_model\_logistic.py:1208: UserWarning: Setting penalty=None will ignore the C and l1_ratio parameters
  warnings.warn(
C:\Users\bakhtiyar\.conda\envs\myenv\lib\site-packages\sklearn\linear_model\_sag.py:349: ConvergenceWarning: The max_iter was reached which means the coef_ did not converge
  warnings.warn(
C:\Users\bakhtiyar\.conda\envs\myenv\lib\site-packages\sklearn\linear_model\_logistic.py:1208: UserWarning: Setting penalty=None will ignore the C and l1_ratio parameters
  warnings.warn(
C:\Users\bakhtiyar\.conda\envs\myenv\lib\site-packages\sklearn\linear_model\_sag.py:349: ConvergenceWarning: The max_iter was reached which means the coef_ did not converge
  warnings.warn(
[I 2025-05-24 19:50:16,781] Trial 32 finished with value: 0.9371794871794872 and parameters: {'penalty': None, 'C': 60.27367981893456, 'solver': 'saga', 'max_iter': 266, 'tol': 2.1604487750019662e-05, 'fit_intercept': False, 'class_weight': None}. Best is trial 0 with value: 0.9371794871794872.
C:\Users\bakhtiyar\.conda\envs\myenv\lib\site-packages\sklearn\linear_model\_logistic.py:1208: UserWarning: Setting penalty=None will ignore the C and l1_ratio parameters
  warnings.warn(
C:\Users\bakhtiyar\.conda\envs\myenv\lib\site-packages\sklearn\linear_model\_sag.py:349: ConvergenceWarning: The max_iter was reached which means the coef_ did not converge
  warnings.warn(
C:\Users\bakhtiyar\.conda\envs\myenv\lib\site-packages\sklearn\linear_model\_logistic.py:1208: UserWarning: Setting penalty=None will ignore the C and l1_ratio parameters
  warnings.warn(
C:\Users\bakhtiyar\.conda\envs\myenv\lib\site-packages\sklearn\linear_model\_sag.py:349: ConvergenceWarning: The max_iter was reached which means the coef_ did not converge
  warnings.warn(
C:\Users\bakhtiyar\.conda\envs\myenv\lib\site-packages\sklearn\linear_model\_logistic.py:1208: UserWarning: Setting penalty=None will ignore the C and l1_ratio parameters
  warnings.warn(
C:\Users\bakhtiyar\.conda\envs\myenv\lib\site-packages\sklearn\linear_model\_sag.py:349: ConvergenceWarning: The max_iter was reached which means the coef_ did not converge
  warnings.warn(
C:\Users\bakhtiyar\.conda\envs\myenv\lib\site-packages\sklearn\linear_model\_logistic.py:1208: UserWarning: Setting penalty=None will ignore the C and l1_ratio parameters
  warnings.warn(
C:\Users\bakhtiyar\.conda\envs\myenv\lib\site-packages\sklearn\linear_model\_sag.py:349: ConvergenceWarning: The max_iter was reached which means the coef_ did not converge
  warnings.warn(
C:\Users\bakhtiyar\.conda\envs\myenv\lib\site-packages\sklearn\linear_model\_logistic.py:1208: UserWarning: Setting penalty=None will ignore the C and l1_ratio parameters
  warnings.warn(
C:\Users\bakhtiyar\.conda\envs\myenv\lib\site-packages\sklearn\linear_model\_sag.py:349: ConvergenceWarning: The max_iter was reached which means the coef_ did not converge
  warnings.warn(
[I 2025-05-24 19:50:16,920] Trial 33 finished with value: 0.9371794871794872 and parameters: {'penalty': None, 'C': 6.230703922326366, 'solver': 'saga', 'max_iter': 245, 'tol': 1.3504120153020401e-05, 'fit_intercept': False, 'class_weight': None}. Best is trial 0 with value: 0.9371794871794872.
C:\Users\bakhtiyar\.conda\envs\myenv\lib\site-packages\sklearn\linear_model\_logistic.py:1208: UserWarning: Setting penalty=None will ignore the C and l1_ratio parameters
  warnings.warn(
C:\Users\bakhtiyar\.conda\envs\myenv\lib\site-packages\sklearn\linear_model\_sag.py:349: ConvergenceWarning: The max_iter was reached which means the coef_ did not converge
  warnings.warn(
C:\Users\bakhtiyar\.conda\envs\myenv\lib\site-packages\sklearn\linear_model\_logistic.py:1208: UserWarning: Setting penalty=None will ignore the C and l1_ratio parameters
  warnings.warn(
C:\Users\bakhtiyar\.conda\envs\myenv\lib\site-packages\sklearn\linear_model\_sag.py:349: ConvergenceWarning: The max_iter was reached which means the coef_ did not converge
  warnings.warn(
C:\Users\bakhtiyar\.conda\envs\myenv\lib\site-packages\sklearn\linear_model\_logistic.py:1208: UserWarning: Setting penalty=None will ignore the C and l1_ratio parameters
  warnings.warn(
C:\Users\bakhtiyar\.conda\envs\myenv\lib\site-packages\sklearn\linear_model\_sag.py:349: ConvergenceWarning: The max_iter was reached which means the coef_ did not converge
  warnings.warn(
C:\Users\bakhtiyar\.conda\envs\myenv\lib\site-packages\sklearn\linear_model\_logistic.py:1208: UserWarning: Setting penalty=None will ignore the C and l1_ratio parameters
  warnings.warn(
C:\Users\bakhtiyar\.conda\envs\myenv\lib\site-packages\sklearn\linear_model\_sag.py:349: ConvergenceWarning: The max_iter was reached which means the coef_ did not converge
  warnings.warn(
C:\Users\bakhtiyar\.conda\envs\myenv\lib\site-packages\sklearn\linear_model\_logistic.py:1208: UserWarning: Setting penalty=None will ignore the C and l1_ratio parameters
  warnings.warn(
C:\Users\bakhtiyar\.conda\envs\myenv\lib\site-packages\sklearn\linear_model\_sag.py:349: ConvergenceWarning: The max_iter was reached which means the coef_ did not converge
  warnings.warn(
[I 2025-05-24 19:50:17,093] Trial 34 finished with value: 0.9371794871794872 and parameters: {'penalty': None, 'C': 0.4199363733788445, 'solver': 'saga', 'max_iter': 547, 'tol': 6.565245375326234e-05, 'fit_intercept': False, 'class_weight': None}. Best is trial 0 with value: 0.9371794871794872.
C:\Users\bakhtiyar\.conda\envs\myenv\lib\site-packages\sklearn\linear_model\_sag.py:349: ConvergenceWarning: The max_iter was reached which means the coef_ did not converge
  warnings.warn(
C:\Users\bakhtiyar\.conda\envs\myenv\lib\site-packages\sklearn\linear_model\_sag.py:349: ConvergenceWarning: The max_iter was reached which means the coef_ did not converge
  warnings.warn(
C:\Users\bakhtiyar\.conda\envs\myenv\lib\site-packages\sklearn\linear_model\_sag.py:349: ConvergenceWarning: The max_iter was reached which means the coef_ did not converge
  warnings.warn(
C:\Users\bakhtiyar\.conda\envs\myenv\lib\site-packages\sklearn\linear_model\_sag.py:349: ConvergenceWarning: The max_iter was reached which means the coef_ did not converge
  warnings.warn(
C:\Users\bakhtiyar\.conda\envs\myenv\lib\site-packages\sklearn\linear_model\_sag.py:349: ConvergenceWarning: The max_iter was reached which means the coef_ did not converge
  warnings.warn(
[I 2025-05-24 19:50:17,244] Trial 35 finished with value: 0.9371794871794872 and parameters: {'penalty': 'l2', 'C': 4.632761979871264, 'solver': 'saga', 'max_iter': 420, 'tol': 0.00013834534589144952, 'fit_intercept': False, 'class_weight': None}. Best is trial 0 with value: 0.9371794871794872.
C:\Users\bakhtiyar\.conda\envs\myenv\lib\site-packages\sklearn\linear_model\_sag.py:349: ConvergenceWarning: The max_iter was reached which means the coef_ did not converge
  warnings.warn(
C:\Users\bakhtiyar\.conda\envs\myenv\lib\site-packages\sklearn\linear_model\_sag.py:349: ConvergenceWarning: The max_iter was reached which means the coef_ did not converge
  warnings.warn(
C:\Users\bakhtiyar\.conda\envs\myenv\lib\site-packages\sklearn\linear_model\_sag.py:349: ConvergenceWarning: The max_iter was reached which means the coef_ did not converge
  warnings.warn(
C:\Users\bakhtiyar\.conda\envs\myenv\lib\site-packages\sklearn\linear_model\_sag.py:349: ConvergenceWarning: The max_iter was reached which means the coef_ did not converge
  warnings.warn(
C:\Users\bakhtiyar\.conda\envs\myenv\lib\site-packages\sklearn\linear_model\_sag.py:349: ConvergenceWarning: The max_iter was reached which means the coef_ did not converge
  warnings.warn(
[I 2025-05-24 19:50:17,448] Trial 36 finished with value: 0.9371794871794872 and parameters: {'penalty': 'l1', 'C': 31.299879797235977, 'solver': 'lbfgs', 'max_iter': 652, 'tol': 2.8286117943376518e-05, 'fit_intercept': True, 'class_weight': None}. Best is trial 0 with value: 0.9371794871794872.
C:\Users\bakhtiyar\.conda\envs\myenv\lib\site-packages\sklearn\linear_model\_logistic.py:1208: UserWarning: Setting penalty=None will ignore the C and l1_ratio parameters
  warnings.warn(
C:\Users\bakhtiyar\.conda\envs\myenv\lib\site-packages\sklearn\linear_model\_sag.py:349: ConvergenceWarning: The max_iter was reached which means the coef_ did not converge
  warnings.warn(
C:\Users\bakhtiyar\.conda\envs\myenv\lib\site-packages\sklearn\linear_model\_logistic.py:1208: UserWarning: Setting penalty=None will ignore the C and l1_ratio parameters
  warnings.warn(
C:\Users\bakhtiyar\.conda\envs\myenv\lib\site-packages\sklearn\linear_model\_sag.py:349: ConvergenceWarning: The max_iter was reached which means the coef_ did not converge
  warnings.warn(
C:\Users\bakhtiyar\.conda\envs\myenv\lib\site-packages\sklearn\linear_model\_logistic.py:1208: UserWarning: Setting penalty=None will ignore the C and l1_ratio parameters
  warnings.warn(
C:\Users\bakhtiyar\.conda\envs\myenv\lib\site-packages\sklearn\linear_model\_sag.py:349: ConvergenceWarning: The max_iter was reached which means the coef_ did not converge
  warnings.warn(
C:\Users\bakhtiyar\.conda\envs\myenv\lib\site-packages\sklearn\linear_model\_logistic.py:1208: UserWarning: Setting penalty=None will ignore the C and l1_ratio parameters
  warnings.warn(
C:\Users\bakhtiyar\.conda\envs\myenv\lib\site-packages\sklearn\linear_model\_sag.py:349: ConvergenceWarning: The max_iter was reached which means the coef_ did not converge
  warnings.warn(
C:\Users\bakhtiyar\.conda\envs\myenv\lib\site-packages\sklearn\linear_model\_logistic.py:1208: UserWarning: Setting penalty=None will ignore the C and l1_ratio parameters
  warnings.warn(
C:\Users\bakhtiyar\.conda\envs\myenv\lib\site-packages\sklearn\linear_model\_sag.py:349: ConvergenceWarning: The max_iter was reached which means the coef_ did not converge
  warnings.warn(
[I 2025-05-24 19:50:17,729] Trial 37 finished with value: 0.9217948717948719 and parameters: {'penalty': None, 'C': 9.990726664976997, 'solver': 'sag', 'max_iter': 1558, 'tol': 1.4549668273918303e-05, 'fit_intercept': True, 'class_weight': 'balanced'}. Best is trial 0 with value: 0.9371794871794872.
[I 2025-05-24 19:50:17,833] Trial 38 finished with value: 0.9217948717948719 and parameters: {'penalty': 'l2', 'C': 97.34037146283356, 'solver': 'liblinear', 'max_iter': 1867, 'tol': 6.988655348881624e-06, 'fit_intercept': False, 'class_weight': 'balanced'}. Best is trial 0 with value: 0.9371794871794872.
C:\Users\bakhtiyar\.conda\envs\myenv\lib\site-packages\sklearn\linear_model\_logistic.py:1208: UserWarning: Setting penalty=None will ignore the C and l1_ratio parameters
  warnings.warn(
C:\Users\bakhtiyar\.conda\envs\myenv\lib\site-packages\sklearn\linear_model\_logistic.py:1208: UserWarning: Setting penalty=None will ignore the C and l1_ratio parameters
  warnings.warn(
C:\Users\bakhtiyar\.conda\envs\myenv\lib\site-packages\sklearn\linear_model\_logistic.py:1208: UserWarning: Setting penalty=None will ignore the C and l1_ratio parameters
  warnings.warn(
C:\Users\bakhtiyar\.conda\envs\myenv\lib\site-packages\sklearn\linear_model\_logistic.py:1208: UserWarning: Setting penalty=None will ignore the C and l1_ratio parameters
  warnings.warn(
C:\Users\bakhtiyar\.conda\envs\myenv\lib\site-packages\sklearn\linear_model\_logistic.py:1208: UserWarning: Setting penalty=None will ignore the C and l1_ratio parameters
  warnings.warn(
[I 2025-05-24 19:50:17,959] Trial 39 finished with value: 0.9217948717948719 and parameters: {'penalty': None, 'C': 0.0008898531181251397, 'solver': 'newton-cg', 'max_iter': 1319, 'tol': 3.4001709640129306e-06, 'fit_intercept': False, 'class_weight': None}. Best is trial 0 with value: 0.9371794871794872.
[I 2025-05-24 19:50:18,071] Trial 40 finished with value: 0.9217948717948719 and parameters: {'penalty': 'elasticnet', 'C': 0.10747587541283579, 'solver': 'saga', 'max_iter': 901, 'tol': 0.00018231676546796806, 'fit_intercept': True, 'class_weight': 'balanced', 'l1_ratio': 0.5166868069741698}. Best is trial 0 with value: 0.9371794871794872.
[I 2025-05-24 19:50:18,174] Trial 41 finished with value: 0.9371794871794872 and parameters: {'penalty': 'l2', 'C': 1.7750916111295907, 'solver': 'lbfgs', 'max_iter': 352, 'tol': 5.237623809015658e-05, 'fit_intercept': False, 'class_weight': 'balanced'}. Best is trial 0 with value: 0.9371794871794872.
[I 2025-05-24 19:50:18,287] Trial 42 finished with value: 0.9371794871794872 and parameters: {'penalty': 'l2', 'C': 4.557957284115899, 'solver': 'lbfgs', 'max_iter': 197, 'tol': 0.0001028851048149972, 'fit_intercept': False, 'class_weight': 'balanced'}. Best is trial 0 with value: 0.9371794871794872.
[I 2025-05-24 19:50:18,390] Trial 43 finished with value: 0.9371794871794872 and parameters: {'penalty': 'l2', 'C': 0.8228142067066458, 'solver': 'lbfgs', 'max_iter': 446, 'tol': 5.2277547202933316e-05, 'fit_intercept': False, 'class_weight': 'balanced'}. Best is trial 0 with value: 0.9371794871794872.
[I 2025-05-24 19:50:18,493] Trial 44 finished with value: 0.9217948717948719 and parameters: {'penalty': 'l2', 'C': 14.049967004854382, 'solver': 'lbfgs', 'max_iter': 521, 'tol': 2.627552904240738e-05, 'fit_intercept': False, 'class_weight': 'balanced'}. Best is trial 0 with value: 0.9371794871794872.
[I 2025-05-24 19:50:18,589] Trial 45 finished with value: 0.5307692307692308 and parameters: {'penalty': 'l1', 'C': 0.012413152615414966, 'solver': 'lbfgs', 'max_iter': 317, 'tol': 1.7293959347580843e-05, 'fit_intercept': False, 'class_weight': 'balanced'}. Best is trial 0 with value: 0.9371794871794872.
[I 2025-05-24 19:50:18,685] Trial 46 finished with value: 0.9217948717948719 and parameters: {'penalty': 'l2', 'C': 33.19606837866611, 'solver': 'liblinear', 'max_iter': 793, 'tol': 0.0003309862633531266, 'fit_intercept': False, 'class_weight': 'balanced'}. Best is trial 0 with value: 0.9371794871794872.
C:\Users\bakhtiyar\.conda\envs\myenv\lib\site-packages\sklearn\linear_model\_logistic.py:1208: UserWarning: Setting penalty=None will ignore the C and l1_ratio parameters
  warnings.warn(
C:\Users\bakhtiyar\.conda\envs\myenv\lib\site-packages\sklearn\linear_model\_sag.py:349: ConvergenceWarning: The max_iter was reached which means the coef_ did not converge
  warnings.warn(
C:\Users\bakhtiyar\.conda\envs\myenv\lib\site-packages\sklearn\linear_model\_logistic.py:1208: UserWarning: Setting penalty=None will ignore the C and l1_ratio parameters
  warnings.warn(
C:\Users\bakhtiyar\.conda\envs\myenv\lib\site-packages\sklearn\linear_model\_sag.py:349: ConvergenceWarning: The max_iter was reached which means the coef_ did not converge
  warnings.warn(
C:\Users\bakhtiyar\.conda\envs\myenv\lib\site-packages\sklearn\linear_model\_logistic.py:1208: UserWarning: Setting penalty=None will ignore the C and l1_ratio parameters
  warnings.warn(
C:\Users\bakhtiyar\.conda\envs\myenv\lib\site-packages\sklearn\linear_model\_sag.py:349: ConvergenceWarning: The max_iter was reached which means the coef_ did not converge
  warnings.warn(
C:\Users\bakhtiyar\.conda\envs\myenv\lib\site-packages\sklearn\linear_model\_logistic.py:1208: UserWarning: Setting penalty=None will ignore the C and l1_ratio parameters
  warnings.warn(
C:\Users\bakhtiyar\.conda\envs\myenv\lib\site-packages\sklearn\linear_model\_sag.py:349: ConvergenceWarning: The max_iter was reached which means the coef_ did not converge
  warnings.warn(
C:\Users\bakhtiyar\.conda\envs\myenv\lib\site-packages\sklearn\linear_model\_logistic.py:1208: UserWarning: Setting penalty=None will ignore the C and l1_ratio parameters
  warnings.warn(
C:\Users\bakhtiyar\.conda\envs\myenv\lib\site-packages\sklearn\linear_model\_sag.py:349: ConvergenceWarning: The max_iter was reached which means the coef_ did not converge
  warnings.warn(
