C:\Users\bakhtiyar\.conda\envs\myenv\python.exe C:\Users\bakhtiyar\Projects\LazyUp_AI_Module\device_input\exp_v1_logistic_regression_classifier.py
Начало оптимизации гиперпараметров...
[I 2025-05-24 19:50:12,864] A new study created in memory with name: no-name-7dc01031-ccaf-4b54-a93c-68599bb94c67
[I 2025-05-24 19:50:12,959] Trial 0 finished with value: 0.9371794871794872 and parameters: {'penalty': 'l2', 'C': 0.5734832745724739, 'solver': 'lbfgs', 'max_iter': 589, 'tol': 4.1447041401072306e-05, 'fit_intercept': False, 'class_weight': 'balanced'}. Best is trial 0 with value: 0.9371794871794872.
[I 2025-05-24 19:50:13,042] Trial 1 finished with value: 0.5307692307692308 and parameters: {'penalty': 'elasticnet', 'C': 9.108983676300191e-05, 'solver': 'lbfgs', 'max_iter': 128, 'tol': 2.201746124237426e-06, 'fit_intercept': False, 'class_weight': None, 'l1_ratio': 0.8300059356957946}. Best is trial 0 with value: 0.9371794871794872.
C:\Users\bakhtiyar\.conda\envs\myenv\lib\site-packages\sklearn\linear_model\_logistic.py:1208: UserWarning: Setting penalty=None will ignore the C and l1_ratio parameters
  warnings.warn(
C:\Users\bakhtiyar\.conda\envs\myenv\lib\site-packages\sklearn\linear_model\_sag.py:349: ConvergenceWarning: The max_iter was reached which means the coef_ did not converge
  warnings.warn(
C:\Users\bakhtiyar\.conda\envs\myenv\lib\site-packages\sklearn\linear_model\_logistic.py:1208: UserWarning: Setting penalty=None will ignore the C and l1_ratio parameters
  warnings.warn(
C:\Users\bakhtiyar\.conda\envs\myenv\lib\site-packages\sklearn\linear_model\_sag.py:349: ConvergenceWarning: The max_iter was reached which means the coef_ did not converge
  warnings.warn(
C:\Users\bakhtiyar\.conda\envs\myenv\lib\site-packages\sklearn\linear_model\_logistic.py:1208: UserWarning: Setting penalty=None will ignore the C and l1_ratio parameters
  warnings.warn(
C:\Users\bakhtiyar\.conda\envs\myenv\lib\site-packages\sklearn\linear_model\_sag.py:349: ConvergenceWarning: The max_iter was reached which means the coef_ did not converge
  warnings.warn(
C:\Users\bakhtiyar\.conda\envs\myenv\lib\site-packages\sklearn\linear_model\_logistic.py:1208: UserWarning: Setting penalty=None will ignore the C and l1_ratio parameters
  warnings.warn(
C:\Users\bakhtiyar\.conda\envs\myenv\lib\site-packages\sklearn\linear_model\_sag.py:349: ConvergenceWarning: The max_iter was reached which means the coef_ did not converge
  warnings.warn(
C:\Users\bakhtiyar\.conda\envs\myenv\lib\site-packages\sklearn\linear_model\_logistic.py:1208: UserWarning: Setting penalty=None will ignore the C and l1_ratio parameters
  warnings.warn(
C:\Users\bakhtiyar\.conda\envs\myenv\lib\site-packages\sklearn\linear_model\_sag.py:349: ConvergenceWarning: The max_iter was reached which means the coef_ did not converge
  warnings.warn(
[I 2025-05-24 19:50:13,205] Trial 2 finished with value: 0.9371794871794872 and parameters: {'penalty': None, 'C': 4.9523119066870995, 'solver': 'saga', 'max_iter': 635, 'tol': 0.00012960004400783213, 'fit_intercept': False, 'class_weight': None}. Best is trial 0 with value: 0.9371794871794872.
[I 2025-05-24 19:50:13,325] Trial 3 finished with value: 0.5307692307692308 and parameters: {'penalty': 'l2', 'C': 5.461312784689419e-05, 'solver': 'saga', 'max_iter': 1773, 'tol': 2.0824847882736043e-05, 'fit_intercept': True, 'class_weight': None}. Best is trial 0 with value: 0.9371794871794872.
[I 2025-05-24 19:50:13,422] Trial 4 finished with value: 0.9371794871794872 and parameters: {'penalty': 'l2', 'C': 0.6258785395941768, 'solver': 'newton-cg', 'max_iter': 1970, 'tol': 1.1888930785405789e-05, 'fit_intercept': True, 'class_weight': None}. Best is trial 0 with value: 0.9371794871794872.
[I 2025-05-24 19:50:13,505] Trial 5 finished with value: 0.5307692307692308 and parameters: {'penalty': 'l1', 'C': 0.0017471854242167933, 'solver': 'lbfgs', 'max_iter': 617, 'tol': 0.0002197303788390811, 'fit_intercept': False, 'class_weight': None}. Best is trial 0 with value: 0.9371794871794872.
C:\Users\bakhtiyar\.conda\envs\myenv\lib\site-packages\sklearn\linear_model\_logistic.py:1208: UserWarning: Setting penalty=None will ignore the C and l1_ratio parameters
  warnings.warn(
C:\Users\bakhtiyar\.conda\envs\myenv\lib\site-packages\sklearn\linear_model\_logistic.py:1208: UserWarning: Setting penalty=None will ignore the C and l1_ratio parameters
  warnings.warn(
C:\Users\bakhtiyar\.conda\envs\myenv\lib\site-packages\sklearn\linear_model\_logistic.py:1208: UserWarning: Setting penalty=None will ignore the C and l1_ratio parameters
  warnings.warn(
C:\Users\bakhtiyar\.conda\envs\myenv\lib\site-packages\sklearn\linear_model\_logistic.py:1208: UserWarning: Setting penalty=None will ignore the C and l1_ratio parameters
  warnings.warn(
C:\Users\bakhtiyar\.conda\envs\myenv\lib\site-packages\sklearn\linear_model\_logistic.py:1208: UserWarning: Setting penalty=None will ignore the C and l1_ratio parameters
  warnings.warn(
[I 2025-05-24 19:50:13,604] Trial 6 finished with value: 0.9217948717948719 and parameters: {'penalty': None, 'C': 0.5572536955044358, 'solver': 'newton-cg', 'max_iter': 1404, 'tol': 1.833026388821669e-05, 'fit_intercept': True, 'class_weight': 'balanced'}. Best is trial 0 with value: 0.9371794871794872.
[I 2025-05-24 19:50:13,688] Trial 7 finished with value: 0.48461538461538467 and parameters: {'penalty': 'l1', 'C': 0.003976036647512891, 'solver': 'lbfgs', 'max_iter': 1695, 'tol': 1.1003398694630205e-05, 'fit_intercept': True, 'class_weight': 'balanced'}. Best is trial 0 with value: 0.9371794871794872.
C:\Users\bakhtiyar\.conda\envs\myenv\lib\site-packages\sklearn\linear_model\_logistic.py:1208: UserWarning: Setting penalty=None will ignore the C and l1_ratio parameters
  warnings.warn(
C:\Users\bakhtiyar\.conda\envs\myenv\lib\site-packages\sklearn\linear_model\_sag.py:349: ConvergenceWarning: The max_iter was reached which means the coef_ did not converge
  warnings.warn(
C:\Users\bakhtiyar\.conda\envs\myenv\lib\site-packages\sklearn\linear_model\_logistic.py:1208: UserWarning: Setting penalty=None will ignore the C and l1_ratio parameters
  warnings.warn(
C:\Users\bakhtiyar\.conda\envs\myenv\lib\site-packages\sklearn\linear_model\_sag.py:349: ConvergenceWarning: The max_iter was reached which means the coef_ did not converge
  warnings.warn(
C:\Users\bakhtiyar\.conda\envs\myenv\lib\site-packages\sklearn\linear_model\_logistic.py:1208: UserWarning: Setting penalty=None will ignore the C and l1_ratio parameters
  warnings.warn(
C:\Users\bakhtiyar\.conda\envs\myenv\lib\site-packages\sklearn\linear_model\_sag.py:349: ConvergenceWarning: The max_iter was reached which means the coef_ did not converge
  warnings.warn(
C:\Users\bakhtiyar\.conda\envs\myenv\lib\site-packages\sklearn\linear_model\_logistic.py:1208: UserWarning: Setting penalty=None will ignore the C and l1_ratio parameters
  warnings.warn(
C:\Users\bakhtiyar\.conda\envs\myenv\lib\site-packages\sklearn\linear_model\_sag.py:349: ConvergenceWarning: The max_iter was reached which means the coef_ did not converge
  warnings.warn(
C:\Users\bakhtiyar\.conda\envs\myenv\lib\site-packages\sklearn\linear_model\_logistic.py:1208: UserWarning: Setting penalty=None will ignore the C and l1_ratio parameters
  warnings.warn(
C:\Users\bakhtiyar\.conda\envs\myenv\lib\site-packages\sklearn\linear_model\_sag.py:349: ConvergenceWarning: The max_iter was reached which means the coef_ did not converge
  warnings.warn(
[I 2025-05-24 19:50:13,793] Trial 8 finished with value: 0.9371794871794872 and parameters: {'penalty': None, 'C': 59.74844801552498, 'solver': 'saga', 'max_iter': 198, 'tol': 5.215361962160469e-05, 'fit_intercept': False, 'class_weight': None}. Best is trial 0 with value: 0.9371794871794872.
[I 2025-05-24 19:50:13,881] Trial 9 finished with value: 0.9217948717948719 and parameters: {'penalty': 'l2', 'C': 0.0005006014003983287, 'solver': 'sag', 'max_iter': 1243, 'tol': 5.1605616819088956e-06, 'fit_intercept': True, 'class_weight': 'balanced'}. Best is trial 0 with value: 0.9371794871794872.
[I 2025-05-24 19:50:13,979] Trial 10 finished with value: 0.9217948717948719 and parameters: {'penalty': 'elasticnet', 'C': 0.04931327891278189, 'solver': 'liblinear', 'max_iter': 817, 'tol': 0.0006336787084455633, 'fit_intercept': False, 'class_weight': 'balanced', 'l1_ratio': 0.0030832764388187828}. Best is trial 0 with value: 0.9371794871794872.
C:\Users\bakhtiyar\.conda\envs\myenv\lib\site-packages\sklearn\linear_model\_logistic.py:1208: UserWarning: Setting penalty=None will ignore the C and l1_ratio parameters
  warnings.warn(
C:\Users\bakhtiyar\.conda\envs\myenv\lib\site-packages\sklearn\linear_model\_sag.py:349: ConvergenceWarning: The max_iter was reached which means the coef_ did not converge
  warnings.warn(
C:\Users\bakhtiyar\.conda\envs\myenv\lib\site-packages\sklearn\linear_model\_logistic.py:1208: UserWarning: Setting penalty=None will ignore the C and l1_ratio parameters
  warnings.warn(
C:\Users\bakhtiyar\.conda\envs\myenv\lib\site-packages\sklearn\linear_model\_sag.py:349: ConvergenceWarning: The max_iter was reached which means the coef_ did not converge
  warnings.warn(
C:\Users\bakhtiyar\.conda\envs\myenv\lib\site-packages\sklearn\linear_model\_logistic.py:1208: UserWarning: Setting penalty=None will ignore the C and l1_ratio parameters
  warnings.warn(
C:\Users\bakhtiyar\.conda\envs\myenv\lib\site-packages\sklearn\linear_model\_sag.py:349: ConvergenceWarning: The max_iter was reached which means the coef_ did not converge
  warnings.warn(
C:\Users\bakhtiyar\.conda\envs\myenv\lib\site-packages\sklearn\linear_model\_logistic.py:1208: UserWarning: Setting penalty=None will ignore the C and l1_ratio parameters
  warnings.warn(
C:\Users\bakhtiyar\.conda\envs\myenv\lib\site-packages\sklearn\linear_model\_sag.py:349: ConvergenceWarning: The max_iter was reached which means the coef_ did not converge
  warnings.warn(
C:\Users\bakhtiyar\.conda\envs\myenv\lib\site-packages\sklearn\linear_model\_logistic.py:1208: UserWarning: Setting penalty=None will ignore the C and l1_ratio parameters
  warnings.warn(
C:\Users\bakhtiyar\.conda\envs\myenv\lib\site-packages\sklearn\linear_model\_sag.py:349: ConvergenceWarning: The max_iter was reached which means the coef_ did not converge
  warnings.warn(
[I 2025-05-24 19:50:14,148] Trial 11 finished with value: 0.9217948717948719 and parameters: {'penalty': None, 'C': 14.895651927516825, 'solver': 'saga', 'max_iter': 573, 'tol': 9.024793112517815e-05, 'fit_intercept': False, 'class_weight': 'balanced'}. Best is trial 0 with value: 0.9371794871794872.
C:\Users\bakhtiyar\.conda\envs\myenv\lib\site-packages\sklearn\linear_model\_logistic.py:1208: UserWarning: Setting penalty=None will ignore the C and l1_ratio parameters
  warnings.warn(
C:\Users\bakhtiyar\.conda\envs\myenv\lib\site-packages\sklearn\linear_model\_logistic.py:1208: UserWarning: Setting penalty=None will ignore the C and l1_ratio parameters
  warnings.warn(
C:\Users\bakhtiyar\.conda\envs\myenv\lib\site-packages\sklearn\linear_model\_logistic.py:1208: UserWarning: Setting penalty=None will ignore the C and l1_ratio parameters
  warnings.warn(
C:\Users\bakhtiyar\.conda\envs\myenv\lib\site-packages\sklearn\linear_model\_logistic.py:1208: UserWarning: Setting penalty=None will ignore the C and l1_ratio parameters
  warnings.warn(
C:\Users\bakhtiyar\.conda\envs\myenv\lib\site-packages\sklearn\linear_model\_logistic.py:1208: UserWarning: Setting penalty=None will ignore the C and l1_ratio parameters
  warnings.warn(
[I 2025-05-24 19:50:14,245] Trial 12 finished with value: 0.9217948717948719 and parameters: {'penalty': None, 'C': 2.3284227384234715, 'solver': 'liblinear', 'max_iter': 923, 'tol': 0.0001625471502564244, 'fit_intercept': False, 'class_weight': 'balanced'}. Best is trial 0 with value: 0.9371794871794872.
[I 2025-05-24 19:50:14,338] Trial 13 finished with value: 0.9064102564102564 and parameters: {'penalty': 'l2', 'C': 0.11189121295963513, 'solver': 'sag', 'max_iter': 494, 'tol': 0.0006706424872810225, 'fit_intercept': False, 'class_weight': None}. Best is trial 0 with value: 0.9371794871794872.
[I 2025-05-24 19:50:14,440] Trial 14 finished with value: 0.9371794871794872 and parameters: {'penalty': 'l2', 'C': 6.113393442264201, 'solver': 'lbfgs', 'max_iter': 401, 'tol': 4.860690966092874e-05, 'fit_intercept': False, 'class_weight': 'balanced'}. Best is trial 0 with value: 0.9371794871794872.
C:\Users\bakhtiyar\.conda\envs\myenv\lib\site-packages\sklearn\linear_model\_logistic.py:1208: UserWarning: Setting penalty=None will ignore the C and l1_ratio parameters
  warnings.warn(
C:\Users\bakhtiyar\.conda\envs\myenv\lib\site-packages\sklearn\linear_model\_logistic.py:1208: UserWarning: Setting penalty=None will ignore the C and l1_ratio parameters
  warnings.warn(
C:\Users\bakhtiyar\.conda\envs\myenv\lib\site-packages\sklearn\linear_model\_logistic.py:1208: UserWarning: Setting penalty=None will ignore the C and l1_ratio parameters
  warnings.warn(
C:\Users\bakhtiyar\.conda\envs\myenv\lib\site-packages\sklearn\linear_model\_logistic.py:1208: UserWarning: Setting penalty=None will ignore the C and l1_ratio parameters
  warnings.warn(
C:\Users\bakhtiyar\.conda\envs\myenv\lib\site-packages\sklearn\linear_model\_logistic.py:1208: UserWarning: Setting penalty=None will ignore the C and l1_ratio parameters
  warnings.warn(
[I 2025-05-24 19:50:14,676] Trial 15 finished with value: 0.9217948717948719 and parameters: {'penalty': None, 'C': 77.14888076406201, 'solver': 'saga', 'max_iter': 1205, 'tol': 0.0002440590774523194, 'fit_intercept': False, 'class_weight': None}. Best is trial 0 with value: 0.9371794871794872.
[I 2025-05-24 19:50:14,789] Trial 16 finished with value: 0.9217948717948719 and parameters: {'penalty': 'elasticnet', 'C': 0.2681877072309942, 'solver': 'saga', 'max_iter': 874, 'tol': 9.8539929102255e-05, 'fit_intercept': False, 'class_weight': None, 'l1_ratio': 0.24255298948199533}. Best is trial 0 with value: 0.9371794871794872.
[I 2025-05-24 19:50:14,883] Trial 17 finished with value: 0.5307692307692308 and parameters: {'penalty': 'l1', 'C': 0.007552093823519915, 'solver': 'lbfgs', 'max_iter': 733, 'tol': 1.135271598626509e-06, 'fit_intercept': False, 'class_weight': 'balanced'}. Best is trial 0 with value: 0.9371794871794872.
C:\Users\bakhtiyar\.conda\envs\myenv\lib\site-packages\sklearn\linear_model\_logistic.py:1208: UserWarning: Setting penalty=None will ignore the C and l1_ratio parameters
  warnings.warn(
C:\Users\bakhtiyar\.conda\envs\myenv\lib\site-packages\sklearn\linear_model\_logistic.py:1208: UserWarning: Setting penalty=None will ignore the C and l1_ratio parameters
  warnings.warn(
C:\Users\bakhtiyar\.conda\envs\myenv\lib\site-packages\sklearn\linear_model\_logistic.py:1208: UserWarning: Setting penalty=None will ignore the C and l1_ratio parameters
  warnings.warn(
C:\Users\bakhtiyar\.conda\envs\myenv\lib\site-packages\sklearn\linear_model\_logistic.py:1208: UserWarning: Setting penalty=None will ignore the C and l1_ratio parameters
  warnings.warn(
C:\Users\bakhtiyar\.conda\envs\myenv\lib\site-packages\sklearn\linear_model\_logistic.py:1208: UserWarning: Setting penalty=None will ignore the C and l1_ratio parameters
  warnings.warn(
[I 2025-05-24 19:50:14,986] Trial 18 finished with value: 0.9217948717948719 and parameters: {'penalty': None, 'C': 2.8477806660699256, 'solver': 'newton-cg', 'max_iter': 311, 'tol': 3.667323403849856e-05, 'fit_intercept': False, 'class_weight': None}. Best is trial 0 with value: 0.9371794871794872.
[I 2025-05-24 19:50:15,079] Trial 19 finished with value: 0.9217948717948719 and parameters: {'penalty': 'l2', 'C': 0.02097958949662669, 'solver': 'liblinear', 'max_iter': 1007, 'tol': 0.00029324714731412553, 'fit_intercept': False, 'class_weight': 'balanced'}. Best is trial 0 with value: 0.9371794871794872.
C:\Users\bakhtiyar\.conda\envs\myenv\lib\site-packages\sklearn\linear_model\_sag.py:349: ConvergenceWarning: The max_iter was reached which means the coef_ did not converge
  warnings.warn(
C:\Users\bakhtiyar\.conda\envs\myenv\lib\site-packages\sklearn\linear_model\_sag.py:349: ConvergenceWarning: The max_iter was reached which means the coef_ did not converge
  warnings.warn(
C:\Users\bakhtiyar\.conda\envs\myenv\lib\site-packages\sklearn\linear_model\_sag.py:349: ConvergenceWarning: The max_iter was reached which means the coef_ did not converge
  warnings.warn(
C:\Users\bakhtiyar\.conda\envs\myenv\lib\site-packages\sklearn\linear_model\_sag.py:349: ConvergenceWarning: The max_iter was reached which means the coef_ did not converge
  warnings.warn(
C:\Users\bakhtiyar\.conda\envs\myenv\lib\site-packages\sklearn\linear_model\_sag.py:349: ConvergenceWarning: The max_iter was reached which means the coef_ did not converge
  warnings.warn(
[I 2025-05-24 19:50:15,250] Trial 20 finished with value: 0.9371794871794872 and parameters: {'penalty': 'l2', 'C': 7.973889812427848, 'solver': 'sag', 'max_iter': 674, 'tol': 5.130456630588045e-06, 'fit_intercept': False, 'class_weight': None}. Best is trial 0 with value: 0.9371794871794872.
[I 2025-05-24 19:50:15,356] Trial 21 finished with value: 0.9371794871794872 and parameters: {'penalty': 'l2', 'C': 1.288067324884185, 'solver': 'newton-cg', 'max_iter': 1971, 'tol': 8.963039655405555e-06, 'fit_intercept': True, 'class_weight': None}. Best is trial 0 with value: 0.9371794871794872.
[I 2025-05-24 19:50:15,459] Trial 22 finished with value: 0.9371794871794872 and parameters: {'penalty': 'l2', 'C': 0.2973478290852095, 'solver': 'newton-cg', 'max_iter': 1490, 'tol': 2.203404084021723e-05, 'fit_intercept': True, 'class_weight': None}. Best is trial 0 with value: 0.9371794871794872.
[I 2025-05-24 19:50:15,565] Trial 23 finished with value: 0.9217948717948719 and parameters: {'penalty': 'l2', 'C': 21.772655899618997, 'solver': 'newton-cg', 'max_iter': 1134, 'tol': 7.845395346964307e-05, 'fit_intercept': True, 'class_weight': None}. Best is trial 0 with value: 0.9371794871794872.
[I 2025-05-24 19:50:15,668] Trial 24 finished with value: 0.9371794871794872 and parameters: {'penalty': 'l2', 'C': 0.8039557118734819, 'solver': 'newton-cg', 'max_iter': 424, 'tol': 1.0223825282171671e-05, 'fit_intercept': True, 'class_weight': None}. Best is trial 0 with value: 0.9371794871794872.
C:\Users\bakhtiyar\.conda\envs\myenv\lib\site-packages\sklearn\linear_model\_logistic.py:1208: UserWarning: Setting penalty=None will ignore the C and l1_ratio parameters
  warnings.warn(
C:\Users\bakhtiyar\.conda\envs\myenv\lib\site-packages\sklearn\linear_model\_sag.py:349: ConvergenceWarning: The max_iter was reached which means the coef_ did not converge
  warnings.warn(
C:\Users\bakhtiyar\.conda\envs\myenv\lib\site-packages\sklearn\linear_model\_logistic.py:1208: UserWarning: Setting penalty=None will ignore the C and l1_ratio parameters
  warnings.warn(
C:\Users\bakhtiyar\.conda\envs\myenv\lib\site-packages\sklearn\linear_model\_sag.py:349: ConvergenceWarning: The max_iter was reached which means the coef_ did not converge
  warnings.warn(
C:\Users\bakhtiyar\.conda\envs\myenv\lib\site-packages\sklearn\linear_model\_logistic.py:1208: UserWarning: Setting penalty=None will ignore the C and l1_ratio parameters
  warnings.warn(
C:\Users\bakhtiyar\.conda\envs\myenv\lib\site-packages\sklearn\linear_model\_sag.py:349: ConvergenceWarning: The max_iter was reached which means the coef_ did not converge
  warnings.warn(
C:\Users\bakhtiyar\.conda\envs\myenv\lib\site-packages\sklearn\linear_model\_logistic.py:1208: UserWarning: Setting penalty=None will ignore the C and l1_ratio parameters
  warnings.warn(
C:\Users\bakhtiyar\.conda\envs\myenv\lib\site-packages\sklearn\linear_model\_sag.py:349: ConvergenceWarning: The max_iter was reached which means the coef_ did not converge
  warnings.warn(
C:\Users\bakhtiyar\.conda\envs\myenv\lib\site-packages\sklearn\linear_model\_logistic.py:1208: UserWarning: Setting penalty=None will ignore the C and l1_ratio parameters
  warnings.warn(
C:\Users\bakhtiyar\.conda\envs\myenv\lib\site-packages\sklearn\linear_model\_sag.py:349: ConvergenceWarning: The max_iter was reached which means the coef_ did not converge
  warnings.warn(
[I 2025-05-24 19:50:15,943] Trial 25 finished with value: 0.9217948717948719 and parameters: {'penalty': None, 'C': 1.0095254813120644e-05, 'solver': 'saga', 'max_iter': 1392, 'tol': 0.0001298070528086583, 'fit_intercept': True, 'class_weight': None}. Best is trial 0 with value: 0.9371794871794872.
[I 2025-05-24 19:50:16,099] Trial 26 finished with value: 0.9064102564102564 and parameters: {'penalty': 'elasticnet', 'C': 0.15577580544924377, 'solver': 'lbfgs', 'max_iter': 1038, 'tol': 0.00040805146708752343, 'fit_intercept': True, 'class_weight': 'balanced', 'l1_ratio': 0.9884448815510968}. Best is trial 0 with value: 0.9371794871794872.
[I 2025-05-24 19:50:16,206] Trial 27 finished with value: 0.9217948717948719 and parameters: {'penalty': 'l1', 'C': 0.04460820709942721, 'solver': 'saga', 'max_iter': 756, 'tol': 3.1171508520759386e-05, 'fit_intercept': False, 'class_weight': None}. Best is trial 0 with value: 0.9371794871794872.
