C:\Users\bakhtiyar\.conda\envs\myenv\python.exe C:\Users\bakhtiyar\Projects\LazyUp_AI_Module\device_input\exp_v1_cnn_classifier.py
Начало оптимизации гиперпараметров с Optuna...
[I 2025-05-26 20:28:05,691] A new study created in memory with name: cnn_optimization
2025-05-26 20:28:05.694844: I tensorflow/core/platform/cpu_feature_guard.cc:193] This TensorFlow binary is optimized with oneAPI Deep Neural Network Library (oneDNN) to use the following CPU instructions in performance-critical operations:  AVX2
To enable them in other operations, rebuild TensorFlow with the appropriate compiler flags.
2025-05-26 20:28:05.695836: I tensorflow/core/common_runtime/process_util.cc:146] Creating new thread pool with default inter op setting: 2. Tune using inter_op_parallelism_threads for best performance.
[I 2025-05-26 20:28:09,212] Trial 0 finished with value: 0.5357142686843872 and parameters: {'batch_size': 112, 'epochs': 14, 'n_conv_layers': 4, 'optimizer': 'rmsprop', 'learning_rate': 2.2535514902411202e-05, 'filters_layer_0': 224, 'kernel_size_layer_0': 3, 'activation_layer_0': 'relu', 'pool_size_layer_0': 3, 'filters_layer_1': 32, 'kernel_size_layer_1': 2, 'activation_layer_1': 'selu', 'pool_size_layer_1': 3, 'filters_layer_2': 256, 'kernel_size_layer_2': 4, 'activation_layer_2': 'selu', 'pool_size_layer_2': 3, 'filters_layer_3': 256, 'kernel_size_layer_3': 2, 'activation_layer_3': 'relu', 'global_pooling': 'max', 'n_dense_layers': 2, 'dense_units_0': 64, 'dense_activation_0': 'relu', 'dropout_0': 0.4604715225822237, 'dense_units_1': 192, 'dense_activation_1': 'relu', 'dropout_1': 0.1441402373126874, 'patience': 10}. Best is trial 0 with value: 0.5357142686843872.
[I 2025-05-26 20:28:11,671] Trial 1 finished with value: 0.8095238208770752 and parameters: {'batch_size': 48, 'epochs': 22, 'n_conv_layers': 3, 'optimizer': 'sgd', 'learning_rate': 0.0014795278072488546, 'momentum': 0.6128988368953241, 'filters_layer_0': 256, 'kernel_size_layer_0': 4, 'activation_layer_0': 'selu', 'pool_size_layer_0': 2, 'filters_layer_1': 192, 'kernel_size_layer_1': 4, 'activation_layer_1': 'selu', 'pool_size_layer_1': 2, 'filters_layer_2': 64, 'kernel_size_layer_2': 3, 'activation_layer_2': 'elu', 'global_pooling': 'max', 'n_dense_layers': 2, 'dense_units_0': 32, 'dense_activation_0': 'selu', 'dropout_0': 0.22834892658275116, 'dense_units_1': 128, 'dense_activation_1': 'relu', 'dropout_1': 0.48635462984612765, 'patience': 10}. Best is trial 1 with value: 0.8095238208770752.
[I 2025-05-26 20:28:14,658] Trial 2 finished with value: 0.8333333730697632 and parameters: {'batch_size': 96, 'epochs': 16, 'n_conv_layers': 4, 'optimizer': 'adam', 'learning_rate': 8.639367075803151e-05, 'filters_layer_0': 256, 'kernel_size_layer_0': 3, 'activation_layer_0': 'selu', 'pool_size_layer_0': 2, 'filters_layer_1': 256, 'kernel_size_layer_1': 2, 'activation_layer_1': 'elu', 'pool_size_layer_1': 3, 'filters_layer_2': 160, 'kernel_size_layer_2': 5, 'activation_layer_2': 'relu', 'pool_size_layer_2': 2, 'filters_layer_3': 192, 'kernel_size_layer_3': 3, 'activation_layer_3': 'elu', 'global_pooling': 'max', 'n_dense_layers': 1, 'dense_units_0': 32, 'dense_activation_0': 'selu', 'dropout_0': 0.14067467559736702, 'patience': 7}. Best is trial 2 with value: 0.8333333730697632.
[I 2025-05-26 20:28:16,374] Trial 3 finished with value: 0.8095238208770752 and parameters: {'batch_size': 112, 'epochs': 25, 'n_conv_layers': 1, 'optimizer': 'adam', 'learning_rate': 0.0029590293832874467, 'filters_layer_0': 224, 'kernel_size_layer_0': 5, 'activation_layer_0': 'elu', 'global_pooling': 'avg', 'n_dense_layers': 2, 'dense_units_0': 128, 'dense_activation_0': 'relu', 'dropout_0': 0.3644147435690225, 'dense_units_1': 32, 'dense_activation_1': 'relu', 'dropout_1': 0.347294370762649, 'patience': 7}. Best is trial 2 with value: 0.8333333730697632.
[I 2025-05-26 20:28:18,689] Trial 4 finished with value: 0.7619047164916992 and parameters: {'batch_size': 64, 'epochs': 20, 'n_conv_layers': 3, 'optimizer': 'adam', 'learning_rate': 0.0001632930597146473, 'filters_layer_0': 64, 'kernel_size_layer_0': 4, 'activation_layer_0': 'relu', 'pool_size_layer_0': 2, 'filters_layer_1': 96, 'kernel_size_layer_1': 4, 'activation_layer_1': 'selu', 'pool_size_layer_1': 3, 'filters_layer_2': 192, 'kernel_size_layer_2': 2, 'activation_layer_2': 'elu', 'global_pooling': 'max', 'n_dense_layers': 3, 'dense_units_0': 224, 'dense_activation_0': 'selu', 'dropout_0': 0.16701038486742759, 'dense_units_1': 96, 'dense_activation_1': 'elu', 'dropout_1': 0.4863446245526769, 'dense_units_2': 160, 'dense_activation_2': 'selu', 'dropout_2': 0.3342104483956104, 'patience': 4}. Best is trial 2 with value: 0.8333333730697632.
[I 2025-05-26 20:28:22,287] Trial 5 finished with value: 0.8333333134651184 and parameters: {'batch_size': 112, 'epochs': 19, 'n_conv_layers': 4, 'optimizer': 'rmsprop', 'learning_rate': 0.00013905501855019986, 'filters_layer_0': 32, 'kernel_size_layer_0': 5, 'activation_layer_0': 'selu', 'pool_size_layer_0': 2, 'filters_layer_1': 128, 'kernel_size_layer_1': 4, 'activation_layer_1': 'selu', 'pool_size_layer_1': 2, 'filters_layer_2': 160, 'kernel_size_layer_2': 2, 'activation_layer_2': 'elu', 'pool_size_layer_2': 2, 'filters_layer_3': 192, 'kernel_size_layer_3': 3, 'activation_layer_3': 'relu', 'global_pooling': 'avg', 'n_dense_layers': 3, 'dense_units_0': 96, 'dense_activation_0': 'elu', 'dropout_0': 0.4156744600442914, 'dense_units_1': 256, 'dense_activation_1': 'selu', 'dropout_1': 0.22990421252637977, 'dense_units_2': 160, 'dense_activation_2': 'relu', 'dropout_2': 0.24004390290502295, 'patience': 10}. Best is trial 2 with value: 0.8333333730697632.
[I 2025-05-26 20:28:24,842] Trial 6 finished with value: 0.8095237612724304 and parameters: {'batch_size': 112, 'epochs': 26, 'n_conv_layers': 2, 'optimizer': 'rmsprop', 'learning_rate': 3.052721433767994e-05, 'filters_layer_0': 192, 'kernel_size_layer_0': 2, 'activation_layer_0': 'elu', 'pool_size_layer_0': 2, 'filters_layer_1': 192, 'kernel_size_layer_1': 3, 'activation_layer_1': 'selu', 'global_pooling': 'max', 'n_dense_layers': 2, 'dense_units_0': 224, 'dense_activation_0': 'elu', 'dropout_0': 0.40787929480985685, 'dense_units_1': 224, 'dense_activation_1': 'selu', 'dropout_1': 0.48151060915663313, 'patience': 5}. Best is trial 2 with value: 0.8333333730697632.
[I 2025-05-26 20:28:27,284] Trial 7 finished with value: 0.8333333134651184 and parameters: {'batch_size': 96, 'epochs': 17, 'n_conv_layers': 4, 'optimizer': 'adam', 'learning_rate': 0.008640544451859966, 'filters_layer_0': 256, 'kernel_size_layer_0': 4, 'activation_layer_0': 'elu', 'pool_size_layer_0': 3, 'filters_layer_1': 160, 'kernel_size_layer_1': 5, 'activation_layer_1': 'selu', 'pool_size_layer_1': 3, 'filters_layer_2': 96, 'kernel_size_layer_2': 3, 'activation_layer_2': 'elu', 'pool_size_layer_2': 3, 'filters_layer_3': 64, 'kernel_size_layer_3': 5, 'activation_layer_3': 'selu', 'global_pooling': 'max', 'n_dense_layers': 1, 'dense_units_0': 32, 'dense_activation_0': 'relu', 'dropout_0': 0.3828295591458021, 'patience': 8}. Best is trial 2 with value: 0.8333333730697632.
[I 2025-05-26 20:28:29,779] Trial 8 finished with value: 0.8333333134651184 and parameters: {'batch_size': 48, 'epochs': 27, 'n_conv_layers': 3, 'optimizer': 'rmsprop', 'learning_rate': 0.004561659849364548, 'filters_layer_0': 160, 'kernel_size_layer_0': 5, 'activation_layer_0': 'elu', 'pool_size_layer_0': 3, 'filters_layer_1': 224, 'kernel_size_layer_1': 5, 'activation_layer_1': 'relu', 'pool_size_layer_1': 3, 'filters_layer_2': 96, 'kernel_size_layer_2': 2, 'activation_layer_2': 'selu', 'global_pooling': 'max', 'n_dense_layers': 3, 'dense_units_0': 192, 'dense_activation_0': 'elu', 'dropout_0': 0.3406307691670273, 'dense_units_1': 192, 'dense_activation_1': 'relu', 'dropout_1': 0.2963407355452069, 'dense_units_2': 160, 'dense_activation_2': 'selu', 'dropout_2': 0.22326583003413766, 'patience': 7}. Best is trial 2 with value: 0.8333333730697632.
[I 2025-05-26 20:28:31,168] Trial 9 finished with value: 0.773809552192688 and parameters: {'batch_size': 32, 'epochs': 30, 'n_conv_layers': 1, 'optimizer': 'adam', 'learning_rate': 0.0022844880872087813, 'filters_layer_0': 192, 'kernel_size_layer_0': 3, 'activation_layer_0': 'elu', 'global_pooling': 'avg', 'n_dense_layers': 2, 'dense_units_0': 224, 'dense_activation_0': 'selu', 'dropout_0': 0.41260051407985, 'dense_units_1': 64, 'dense_activation_1': 'elu', 'dropout_1': 0.3517850740808305, 'patience': 3}. Best is trial 2 with value: 0.8333333730697632.
[I 2025-05-26 20:28:33,138] Trial 10 finished with value: 0.130952388048172 and parameters: {'batch_size': 80, 'epochs': 10, 'n_conv_layers': 2, 'optimizer': 'sgd', 'learning_rate': 0.0005327139175571356, 'momentum': 0.005766472359653885, 'filters_layer_0': 96, 'kernel_size_layer_0': 2, 'activation_layer_0': 'selu', 'pool_size_layer_0': 2, 'filters_layer_1': 256, 'kernel_size_layer_1': 2, 'activation_layer_1': 'elu', 'global_pooling': 'avg', 'n_dense_layers': 1, 'dense_units_0': 160, 'dense_activation_0': 'selu', 'dropout_0': 0.10075045845463021, 'patience': 5}. Best is trial 2 with value: 0.8333333730697632.
[I 2025-05-26 20:28:35,987] Trial 11 finished with value: 0.6785714626312256 and parameters: {'batch_size': 128, 'epochs': 16, 'n_conv_layers': 4, 'optimizer': 'rmsprop', 'learning_rate': 0.00010891340660936242, 'filters_layer_0': 32, 'kernel_size_layer_0': 3, 'activation_layer_0': 'selu', 'pool_size_layer_0': 2, 'filters_layer_1': 96, 'kernel_size_layer_1': 3, 'activation_layer_1': 'elu', 'pool_size_layer_1': 2, 'filters_layer_2': 160, 'kernel_size_layer_2': 5, 'activation_layer_2': 'relu', 'pool_size_layer_2': 2, 'filters_layer_3': 192, 'kernel_size_layer_3': 3, 'activation_layer_3': 'elu', 'global_pooling': 'avg', 'n_dense_layers': 1, 'dense_units_0': 96, 'dense_activation_0': 'elu', 'dropout_0': 0.2614618174306238, 'patience': 9}. Best is trial 2 with value: 0.8333333730697632.
[I 2025-05-26 20:28:38,925] Trial 12 finished with value: 0.761904776096344 and parameters: {'batch_size': 80, 'epochs': 20, 'n_conv_layers': 4, 'optimizer': 'adam', 'learning_rate': 6.643012919526004e-05, 'filters_layer_0': 128, 'kernel_size_layer_0': 5, 'activation_layer_0': 'selu', 'pool_size_layer_0': 2, 'filters_layer_1': 128, 'kernel_size_layer_1': 3, 'activation_layer_1': 'elu', 'pool_size_layer_1': 2, 'filters_layer_2': 192, 'kernel_size_layer_2': 5, 'activation_layer_2': 'relu', 'pool_size_layer_2': 2, 'filters_layer_3': 160, 'kernel_size_layer_3': 3, 'activation_layer_3': 'elu', 'global_pooling': 'avg', 'n_dense_layers': 3, 'dense_units_0': 96, 'dense_activation_0': 'elu', 'dropout_0': 0.49652276834357245, 'dense_units_1': 256, 'dense_activation_1': 'selu', 'dropout_1': 0.1394745461040402, 'dense_units_2': 32, 'dense_activation_2': 'relu', 'dropout_2': 0.10906388996182809, 'patience': 8}. Best is trial 2 with value: 0.8333333730697632.
[I 2025-05-26 20:28:41,940] Trial 13 finished with value: 0.0357142873108387 and parameters: {'batch_size': 128, 'epochs': 12, 'n_conv_layers': 4, 'optimizer': 'rmsprop', 'learning_rate': 1.0114013348398436e-05, 'filters_layer_0': 32, 'kernel_size_layer_0': 3, 'activation_layer_0': 'selu', 'pool_size_layer_0': 2, 'filters_layer_1': 256, 'kernel_size_layer_1': 4, 'activation_layer_1': 'relu', 'pool_size_layer_1': 2, 'filters_layer_2': 160, 'kernel_size_layer_2': 4, 'activation_layer_2': 'relu', 'pool_size_layer_2': 2, 'filters_layer_3': 224, 'kernel_size_layer_3': 4, 'activation_layer_3': 'relu', 'global_pooling': 'avg', 'n_dense_layers': 1, 'dense_units_0': 64, 'dense_activation_0': 'selu', 'dropout_0': 0.30096935797680435, 'patience': 6}. Best is trial 2 with value: 0.8333333730697632.
[I 2025-05-26 20:28:44,550] Trial 14 finished with value: 0.8333333134651184 and parameters: {'batch_size': 96, 'epochs': 17, 'n_conv_layers': 3, 'optimizer': 'sgd', 'learning_rate': 0.0004008740501036033, 'momentum': 0.811215473503673, 'filters_layer_0': 96, 'kernel_size_layer_0': 4, 'activation_layer_0': 'selu', 'pool_size_layer_0': 2, 'filters_layer_1': 32, 'kernel_size_layer_1': 2, 'activation_layer_1': 'elu', 'pool_size_layer_1': 3, 'filters_layer_2': 224, 'kernel_size_layer_2': 2, 'activation_layer_2': 'elu', 'global_pooling': 'max', 'n_dense_layers': 3, 'dense_units_0': 96, 'dense_activation_0': 'elu', 'dropout_0': 0.17500771718819064, 'dense_units_1': 256, 'dense_activation_1': 'selu', 'dropout_1': 0.23046063658584823, 'dense_units_2': 256, 'dense_activation_2': 'relu', 'dropout_2': 0.474161212640621, 'patience': 9}. Best is trial 2 with value: 0.8333333730697632.
[I 2025-05-26 20:28:47,254] Trial 15 finished with value: 0.8095238208770752 and parameters: {'batch_size': 96, 'epochs': 22, 'n_conv_layers': 4, 'optimizer': 'adam', 'learning_rate': 0.00021341894202024886, 'filters_layer_0': 128, 'kernel_size_layer_0': 2, 'activation_layer_0': 'selu', 'pool_size_layer_0': 2, 'filters_layer_1': 128, 'kernel_size_layer_1': 4, 'activation_layer_1': 'elu', 'pool_size_layer_1': 2, 'filters_layer_2': 128, 'kernel_size_layer_2': 4, 'activation_layer_2': 'relu', 'pool_size_layer_2': 2, 'filters_layer_3': 96, 'kernel_size_layer_3': 2, 'activation_layer_3': 'elu', 'global_pooling': 'avg', 'n_dense_layers': 3, 'dense_units_0': 32, 'dense_activation_0': 'selu', 'dropout_0': 0.13158810482532002, 'dense_units_1': 160, 'dense_activation_1': 'selu', 'dropout_1': 0.21429701460795736, 'dense_units_2': 64, 'dense_activation_2': 'elu', 'dropout_2': 0.27678890152232694, 'patience': 8}. Best is trial 2 with value: 0.8333333730697632.
[I 2025-05-26 20:28:49,244] Trial 16 finished with value: 0.761904776096344 and parameters: {'batch_size': 16, 'epochs': 14, 'n_conv_layers': 2, 'optimizer': 'rmsprop', 'learning_rate': 0.00088528190666139, 'filters_layer_0': 160, 'kernel_size_layer_0': 5, 'activation_layer_0': 'relu', 'pool_size_layer_0': 3, 'filters_layer_1': 96, 'kernel_size_layer_1': 3, 'activation_layer_1': 'relu', 'global_pooling': 'avg', 'n_dense_layers': 1, 'dense_units_0': 128, 'dense_activation_0': 'elu', 'dropout_0': 0.3074974393396049, 'patience': 6}. Best is trial 2 with value: 0.8333333730697632.
[I 2025-05-26 20:28:52,021] Trial 17 finished with value: 0.6904761791229248 and parameters: {'batch_size': 64, 'epochs': 18, 'n_conv_layers': 3, 'optimizer': 'rmsprop', 'learning_rate': 5.805349812870464e-05, 'filters_layer_0': 64, 'kernel_size_layer_0': 4, 'activation_layer_0': 'selu', 'pool_size_layer_0': 2, 'filters_layer_1': 160, 'kernel_size_layer_1': 5, 'activation_layer_1': 'selu', 'pool_size_layer_1': 2, 'filters_layer_2': 32, 'kernel_size_layer_2': 3, 'activation_layer_2': 'elu', 'global_pooling': 'max', 'n_dense_layers': 2, 'dense_units_0': 64, 'dense_activation_0': 'elu', 'dropout_0': 0.22923788432415587, 'dense_units_1': 128, 'dense_activation_1': 'selu', 'dropout_1': 0.23341021852739355, 'patience': 9}. Best is trial 2 with value: 0.8333333730697632.
[I 2025-05-26 20:28:54,682] Trial 18 finished with value: 0.7857142686843872 and parameters: {'batch_size': 128, 'epochs': 23, 'n_conv_layers': 4, 'optimizer': 'adam', 'learning_rate': 8.345197972797488e-05, 'filters_layer_0': 192, 'kernel_size_layer_0': 3, 'activation_layer_0': 'selu', 'pool_size_layer_0': 2, 'filters_layer_1': 192, 'kernel_size_layer_1': 2, 'activation_layer_1': 'elu', 'pool_size_layer_1': 3, 'filters_layer_2': 128, 'kernel_size_layer_2': 5, 'activation_layer_2': 'relu', 'pool_size_layer_2': 2, 'filters_layer_3': 128, 'kernel_size_layer_3': 4, 'activation_layer_3': 'relu', 'global_pooling': 'max', 'n_dense_layers': 1, 'dense_units_0': 160, 'dense_activation_0': 'selu', 'dropout_0': 0.4496736914785823, 'patience': 10}. Best is trial 2 with value: 0.8333333730697632.
[I 2025-05-26 20:28:56,748] Trial 19 finished with value: 0.2261904776096344 and parameters: {'batch_size': 96, 'epochs': 14, 'n_conv_layers': 3, 'optimizer': 'sgd', 'learning_rate': 3.109674518027078e-05, 'momentum': 0.09635617459247281, 'filters_layer_0': 96, 'kernel_size_layer_0': 2, 'activation_layer_0': 'selu', 'pool_size_layer_0': 3, 'filters_layer_1': 64, 'kernel_size_layer_1': 3, 'activation_layer_1': 'selu', 'pool_size_layer_1': 2, 'filters_layer_2': 192, 'kernel_size_layer_2': 4, 'activation_layer_2': 'selu', 'global_pooling': 'avg', 'n_dense_layers': 3, 'dense_units_0': 64, 'dense_activation_0': 'relu', 'dropout_0': 0.2537994986488904, 'dense_units_1': 192, 'dense_activation_1': 'elu', 'dropout_1': 0.10217917027260578, 'dense_units_2': 256, 'dense_activation_2': 'relu', 'dropout_2': 0.11663250215654289, 'patience': 3}. Best is trial 2 with value: 0.8333333730697632.
Лучшие гиперпараметры:
    batch_size: 96
    epochs: 16
    n_conv_layers: 4
    optimizer: adam
    learning_rate: 8.639367075803151e-05
    filters_layer_0: 256
    kernel_size_layer_0: 3
    activation_layer_0: selu
    pool_size_layer_0: 2
    filters_layer_1: 256
    kernel_size_layer_1: 2
    activation_layer_1: elu
    pool_size_layer_1: 3
    filters_layer_2: 160
    kernel_size_layer_2: 5
    activation_layer_2: relu
    pool_size_layer_2: 2
    filters_layer_3: 192
    kernel_size_layer_3: 3
    activation_layer_3: elu
    global_pooling: max
    n_dense_layers: 1
    dense_units_0: 32
    dense_activation_0: selu
    dropout_0: 0.14067467559736702
    patience: 7

Обучение модели с оптимальными гиперпараметрами...
Epoch 1/16
1/1 [==============================] - 4s 4s/step - loss: 1.4147 - accuracy: 0.3542 - auc_20: 0.2622 - val_loss: 0.7030 - val_accuracy: 0.4615 - val_auc_20: 0.4167
Epoch 2/16
1/1 [==============================] - 0s 60ms/step - loss: 0.4323 - accuracy: 0.8750 - auc_20: 0.9019 - val_loss: 0.6661 - val_accuracy: 0.4615 - val_auc_20: 1.0000
Epoch 3/16
1/1 [==============================] - 0s 60ms/step - loss: 0.1769 - accuracy: 0.9375 - auc_20: 0.9757 - val_loss: 0.6411 - val_accuracy: 0.4615 - val_auc_20: 0.9524
Epoch 4/16
1/1 [==============================] - 0s 149ms/step - loss: 0.1224 - accuracy: 0.9375 - auc_20: 0.9896 - val_loss: 0.6251 - val_accuracy: 0.6923 - val_auc_20: 0.8095
Epoch 5/16
1/1 [==============================] - 0s 49ms/step - loss: 0.0761 - accuracy: 0.9583 - auc_20: 1.0000 - val_loss: 0.6154 - val_accuracy: 0.7692 - val_auc_20: 0.8095
Epoch 6/16
1/1 [==============================] - 0s 45ms/step - loss: 0.0515 - accuracy: 0.9583 - auc_20: 1.0000 - val_loss: 0.6082 - val_accuracy: 0.8462 - val_auc_20: 0.8095
Epoch 7/16
1/1 [==============================] - 0s 40ms/step - loss: 0.0552 - accuracy: 0.9792 - auc_20: 1.0000 - val_loss: 0.6023 - val_accuracy: 0.8462 - val_auc_20: 0.8095
Epoch 8/16
1/1 [==============================] - 0s 41ms/step - loss: 0.0442 - accuracy: 0.9792 - auc_20: 1.0000 - val_loss: 0.5980 - val_accuracy: 0.8462 - val_auc_20: 0.8095
Epoch 9/16
1/1 [==============================] - 0s 43ms/step - loss: 0.0344 - accuracy: 0.9792 - auc_20: 1.0000 - val_loss: 0.5952 - val_accuracy: 0.8462 - val_auc_20: 0.8095
Epoch 10/16
1/1 [==============================] - 0s 44ms/step - loss: 0.0261 - accuracy: 0.9792 - auc_20: 1.0000 - val_loss: 0.5937 - val_accuracy: 0.8462 - val_auc_20: 0.8095
Epoch 11/16
1/1 [==============================] - 0s 42ms/step - loss: 0.0288 - accuracy: 1.0000 - auc_20: 1.0000 - val_loss: 0.5934 - val_accuracy: 0.8462 - val_auc_20: 0.7857
Epoch 12/16
1/1 [==============================] - 0s 50ms/step - loss: 0.0115 - accuracy: 1.0000 - auc_20: 1.0000 - val_loss: 0.5935 - val_accuracy: 0.8462 - val_auc_20: 0.7857
Epoch 13/16
1/1 [==============================] - 0s 87ms/step - loss: 0.0190 - accuracy: 1.0000 - auc_20: 1.0000 - val_loss: 0.5945 - val_accuracy: 0.8462 - val_auc_20: 0.7738

Оценка качества на тестовых данных:
1/1 [==============================] - 0s 199ms/step
              precision    recall  f1-score   support

           0       0.88      0.78      0.82         9
           1       0.83      0.91      0.87        11

    accuracy                           0.85        20
   macro avg       0.85      0.84      0.85        20
weighted avg       0.85      0.85      0.85        20

Лучшее значение AUC: 0.8333
Training time: 5.16 с
Max RAM Usage: 13.52 MB
Inference time: 0.2473 s

Process finished with exit code 0
