[I 2025-05-25 11:38:49,177] Trial 31 finished with value: 0.9534798534798534 and parameters: {'n_estimators': 937, 'max_depth': 4, 'learning_rate': 0.10543413122414799, 'booster': 'dart', 'gamma': 0.09489233242380557, 'min_child_weight': 1.706861744773622, 'max_delta_step': 4, 'subsample': 0.6441152095174127, 'colsample_bytree': 0.7807813976305796, 'colsample_bylevel': 0.5726507592057013, 'colsample_bynode': 0.7905904594988817, 'reg_alpha': 0.013274201200121677, 'reg_lambda': 2.4861277453599688e-05, 'sample_type': 'uniform', 'normalize_type': 'forest', 'rate_drop': 0.3843238220202288, 'skip_drop': 0.34412963230509763}. Best is trial 29 with value: 0.9536596736596736.
[I 2025-05-25 11:39:25,836] Trial 32 finished with value: 0.9534798534798534 and parameters: {'n_estimators': 929, 'max_depth': 4, 'learning_rate': 0.1161041901930166, 'booster': 'dart', 'gamma': 0.018995425615226907, 'min_child_weight': 1.7484216977292069, 'max_delta_step': 4, 'subsample': 0.650256733441577, 'colsample_bytree': 0.7803104572548074, 'colsample_bylevel': 0.5498783066311325, 'colsample_bynode': 0.7825585588008165, 'reg_alpha': 0.01493477017821528, 'reg_lambda': 2.697116460569105e-05, 'sample_type': 'uniform', 'normalize_type': 'forest', 'rate_drop': 0.4825065670002354, 'skip_drop': 0.32881650697579007}. Best is trial 29 with value: 0.9536596736596736.
[I 2025-05-25 11:40:01,249] Trial 33 finished with value: 0.9534798534798534 and parameters: {'n_estimators': 939, 'max_depth': 4, 'learning_rate': 0.1194803618905877, 'booster': 'dart', 'gamma': 0.26505515625838694, 'min_child_weight': 1.7753523912593892, 'max_delta_step': 4, 'subsample': 0.6422422976892136, 'colsample_bytree': 0.7899298517069955, 'colsample_bylevel': 0.5824972158939424, 'colsample_bynode': 0.782595485294567, 'reg_alpha': 0.016069282553154915, 'reg_lambda': 1.2219610938977516e-05, 'sample_type': 'uniform', 'normalize_type': 'forest', 'rate_drop': 0.4988927379969391, 'skip_drop': 0.33875554734618624}. Best is trial 29 with value: 0.9536596736596736.
[I 2025-05-25 11:40:41,846] Trial 34 finished with value: 0.9221578421578421 and parameters: {'n_estimators': 934, 'max_depth': 4, 'learning_rate': 0.1443716352514222, 'booster': 'dart', 'gamma': 0.01472416739650854, 'min_child_weight': 1.6553335683884507, 'max_delta_step': 4, 'subsample': 0.6402331849631777, 'colsample_bytree': 0.7808724563689623, 'colsample_bylevel': 0.5787795329660893, 'colsample_bynode': 0.7173046089296383, 'reg_alpha': 0.02163219340225565, 'reg_lambda': 1.3364457089133026e-05, 'sample_type': 'uniform', 'normalize_type': 'forest', 'rate_drop': 0.4996964831273982, 'skip_drop': 0.33878095946116105}. Best is trial 29 with value: 0.9536596736596736.
[I 2025-05-25 11:41:16,152] Trial 35 finished with value: 0.8902630702630703 and parameters: {'n_estimators': 940, 'max_depth': 2, 'learning_rate': 0.1913998572444712, 'booster': 'dart', 'gamma': 0.5233816673213383, 'min_child_weight': 1.7663654211767048, 'max_delta_step': 4, 'subsample': 0.5563417353135816, 'colsample_bytree': 0.7893332867925732, 'colsample_bylevel': 0.5013097141217371, 'colsample_bynode': 0.7770633259690544, 'reg_alpha': 0.21485671382485694, 'reg_lambda': 2.343009269429393e-06, 'sample_type': 'uniform', 'normalize_type': 'forest', 'rate_drop': 0.4541126381302142, 'skip_drop': 0.26396593711724214}. Best is trial 29 with value: 0.9536596736596736.
[I 2025-05-25 11:41:16,579] Trial 36 finished with value: 0.5735822021116139 and parameters: {'n_estimators': 839, 'max_depth': 4, 'learning_rate': 0.10128752391422656, 'booster': 'gblinear', 'gamma': 0.013523143032233093, 'min_child_weight': 2.370959201341491, 'max_delta_step': 6, 'subsample': 0.6908379759816431, 'colsample_bytree': 0.9295413406851368, 'colsample_bylevel': 0.5469433991601649, 'colsample_bynode': 0.7407246013493801, 'reg_alpha': 0.011195010617985232, 'reg_lambda': 4.5871131442356085e-07, 'sample_type': 'uniform', 'normalize_type': 'forest', 'rate_drop': 0.44696876187168844, 'skip_drop': 0.3194168435953545}. Best is trial 29 with value: 0.9536596736596736.
[I 2025-05-25 11:41:56,489] Trial 37 finished with value: 0.8902630702630703 and parameters: {'n_estimators': 984, 'max_depth': 3, 'learning_rate': 0.1951630425365723, 'booster': 'dart', 'gamma': 0.811458598410522, 'min_child_weight': 1.3752156832930518, 'max_delta_step': 5, 'subsample': 0.6497967626515981, 'colsample_bytree': 0.7352384408781367, 'colsample_bylevel': 0.594310623957746, 'colsample_bynode': 0.8177266095680089, 'reg_alpha': 0.02433868601364777, 'reg_lambda': 1.5228473651432803e-07, 'sample_type': 'uniform', 'normalize_type': 'forest', 'rate_drop': 0.390349252365096, 'skip_drop': 0.36558832553538934}. Best is trial 29 with value: 0.9536596736596736.
[I 2025-05-25 11:42:17,741] Trial 38 finished with value: 0.9223443223443223 and parameters: {'n_estimators': 751, 'max_depth': 2, 'learning_rate': 0.11866260531487867, 'booster': 'dart', 'gamma': 0.2515038043047275, 'min_child_weight': 2.0579500342060886, 'max_delta_step': 5, 'subsample': 0.6217652238273009, 'colsample_bytree': 0.7651139176401683, 'colsample_bylevel': 0.6442767889221082, 'colsample_bynode': 0.7741896733282514, 'reg_alpha': 0.0005443567063746401, 'reg_lambda': 6.692765182786331e-08, 'sample_type': 'uniform', 'normalize_type': 'forest', 'rate_drop': 0.4617677913983564, 'skip_drop': 0.28544439344448025}. Best is trial 29 with value: 0.9536596736596736.
[I 2025-05-25 11:42:18,161] Trial 39 finished with value: 0.5735822021116139 and parameters: {'n_estimators': 895, 'max_depth': 6, 'learning_rate': 0.15674113780224325, 'booster': 'gblinear', 'gamma': 0.7916884214948723, 'min_child_weight': 2.4869618266058673, 'max_delta_step': 4, 'subsample': 0.5728379300766689, 'colsample_bytree': 0.6816256544078113, 'colsample_bylevel': 0.5302070485061086, 'colsample_bynode': 0.7375643309393078, 'reg_alpha': 0.010392910354684221, 'reg_lambda': 2.7284119587128196e-05, 'sample_type': 'uniform', 'normalize_type': 'forest', 'rate_drop': 0.4364430198546915, 'skip_drop': 0.3861382816593703}. Best is trial 29 with value: 0.9536596736596736.
[I 2025-05-25 11:42:19,000] Trial 40 finished with value: 0.9213120213120213 and parameters: {'n_estimators': 843, 'max_depth': 4, 'learning_rate': 0.06873235854438062, 'booster': 'gbtree', 'gamma': 1.150688996609443, 'min_child_weight': 1.5964284696220996, 'max_delta_step': 6, 'subsample': 0.506609767151869, 'colsample_bytree': 0.8498050595254637, 'colsample_bylevel': 0.5853984670064298, 'colsample_bynode': 0.8646404029208665, 'reg_alpha': 0.04948601831854076, 'reg_lambda': 5.1010604239180595e-06, 'sample_type': 'uniform', 'normalize_type': 'forest', 'rate_drop': 0.3468880957032925, 'skip_drop': 0.33971520204782957}. Best is trial 29 with value: 0.9536596736596736.
[I 2025-05-25 11:42:40,946] Trial 41 finished with value: 0.9042490842490842 and parameters: {'n_estimators': 776, 'max_depth': 2, 'learning_rate': 0.1257681061642054, 'booster': 'dart', 'gamma': 0.2548943657877647, 'min_child_weight': 2.030738330488689, 'max_delta_step': 5, 'subsample': 0.618352926844119, 'colsample_bytree': 0.763718811326669, 'colsample_bylevel': 0.6570355519912653, 'colsample_bynode': 0.7708788192307496, 'reg_alpha': 0.0001959916298672513, 'reg_lambda': 1.0189157096982579e-08, 'sample_type': 'uniform', 'normalize_type': 'forest', 'rate_drop': 0.4756452400392557, 'skip_drop': 0.2672305201906259}. Best is trial 29 with value: 0.9536596736596736.
[I 2025-05-25 11:43:12,915] Trial 42 finished with value: 0.9223443223443223 and parameters: {'n_estimators': 943, 'max_depth': 2, 'learning_rate': 0.09892630733116016, 'booster': 'dart', 'gamma': 0.2453168739694028, 'min_child_weight': 1.0236675057272326, 'max_delta_step': 4, 'subsample': 0.6576303316368919, 'colsample_bytree': 0.8079554882745608, 'colsample_bylevel': 0.6387905360798405, 'colsample_bynode': 0.7827552145346128, 'reg_alpha': 0.006295652946024232, 'reg_lambda': 1.485930341995066e-07, 'sample_type': 'uniform', 'normalize_type': 'forest', 'rate_drop': 0.49746274169709553, 'skip_drop': 0.3003246723889596}. Best is trial 29 with value: 0.9536596736596736.
[I 2025-05-25 11:43:30,823] Trial 43 finished with value: 0.9046153846153846 and parameters: {'n_estimators': 663, 'max_depth': 4, 'learning_rate': 0.2161393882891777, 'booster': 'dart', 'gamma': 0.6507148616894101, 'min_child_weight': 2.072760938308952, 'max_delta_step': 5, 'subsample': 0.6814681500257719, 'colsample_bytree': 0.7240645007024685, 'colsample_bylevel': 0.6028447030942047, 'colsample_bynode': 0.7540053902103289, 'reg_alpha': 0.0007554201362525857, 'reg_lambda': 6.67579122691398e-08, 'sample_type': 'uniform', 'normalize_type': 'forest', 'rate_drop': 0.38625695548369404, 'skip_drop': 0.2786136085570084}. Best is trial 29 with value: 0.9536596736596736.
[I 2025-05-25 11:44:06,092] Trial 44 finished with value: 0.9046153846153846 and parameters: {'n_estimators': 995, 'max_depth': 3, 'learning_rate': 0.12823307523354965, 'booster': 'dart', 'gamma': 0.25820485507833657, 'min_child_weight': 2.5860311720354647, 'max_delta_step': 3, 'subsample': 0.7265703631796556, 'colsample_bytree': 0.7961975739134116, 'colsample_bylevel': 0.5562486188902718, 'colsample_bynode': 0.8295704966553916, 'reg_alpha': 0.00039259604216921755, 'reg_lambda': 8.637408339860592e-07, 'sample_type': 'uniform', 'normalize_type': 'forest', 'rate_drop': 0.4632040010001843, 'skip_drop': 0.23067932799407095}. Best is trial 29 with value: 0.9536596736596736.
[I 2025-05-25 11:44:28,019] Trial 45 finished with value: 0.858095238095238 and parameters: {'n_estimators': 741, 'max_depth': 6, 'learning_rate': 0.10950236859346814, 'booster': 'dart', 'gamma': 1.46410064381551, 'min_child_weight': 1.5612372349104293, 'max_delta_step': 7, 'subsample': 0.62157060242174, 'colsample_bytree': 0.7605814137054016, 'colsample_bylevel': 0.618204678264754, 'colsample_bynode': 0.795245262279963, 'reg_alpha': 0.19326590347392691, 'reg_lambda': 6.070580284254904e-05, 'sample_type': 'uniform', 'normalize_type': 'forest', 'rate_drop': 0.4301772236007225, 'skip_drop': 0.35064889535792154}. Best is trial 29 with value: 0.9536596736596736.
[I 2025-05-25 11:45:00,924] Trial 46 finished with value: 0.8577289377289377 and parameters: {'n_estimators': 892, 'max_depth': 2, 'learning_rate': 0.16587918236734195, 'booster': 'dart', 'gamma': 0.6113019619967857, 'min_child_weight': 3.280870936600351, 'max_delta_step': 5, 'subsample': 0.5415171690830713, 'colsample_bytree': 0.8495914777374509, 'colsample_bylevel': 0.6889011703217717, 'colsample_bynode': 0.7231098515310989, 'reg_alpha': 0.0025800557030539574, 'reg_lambda': 1.4287405532641514e-05, 'sample_type': 'uniform', 'normalize_type': 'forest', 'rate_drop': 0.3900981291434305, 'skip_drop': 0.32045792063729883}. Best is trial 29 with value: 0.9536596736596736.
[I 2025-05-25 11:45:01,383] Trial 47 finished with value: 0.5735822021116139 and parameters: {'n_estimators': 949, 'max_depth': 5, 'learning_rate': 0.06042652260191291, 'booster': 'gblinear', 'gamma': 0.029461695295495666, 'min_child_weight': 2.047588278321088, 'max_delta_step': 6, 'subsample': 0.5930077689564935, 'colsample_bytree': 0.7633038939060954, 'colsample_bylevel': 0.6475195334445712, 'colsample_bynode': 0.8258598361498003, 'reg_alpha': 0.000487295500818893, 'reg_lambda': 0.00017839203961696513, 'sample_type': 'uniform', 'normalize_type': 'forest', 'rate_drop': 0.40597129306206264, 'skip_drop': 0.4034205969361665}. Best is trial 29 with value: 0.9536596736596736.
[I 2025-05-25 11:45:32,476] Trial 48 finished with value: 0.8745121545121546 and parameters: {'n_estimators': 860, 'max_depth': 1, 'learning_rate': 0.08217887874024586, 'booster': 'dart', 'gamma': 0.9338175344995538, 'min_child_weight': 1.7905303923078217, 'max_delta_step': 4, 'subsample': 0.6403616086394953, 'colsample_bytree': 0.833970954077387, 'colsample_bylevel': 0.5252606629025918, 'colsample_bynode': 0.6807557451311939, 'reg_alpha': 0.027504607722707748, 'reg_lambda': 2.5876391234607674e-06, 'sample_type': 'uniform', 'normalize_type': 'forest', 'rate_drop': 0.46490630145173517, 'skip_drop': 0.3053517649124835}. Best is trial 29 with value: 0.9536596736596736.
[I 2025-05-25 11:46:00,988] Trial 49 finished with value: 0.36820512820512813 and parameters: {'n_estimators': 809, 'max_depth': 3, 'learning_rate': 0.09297062942496756, 'booster': 'dart', 'gamma': 0.4007963887192451, 'min_child_weight': 9.87114767506306, 'max_delta_step': 3, 'subsample': 0.6589054497253489, 'colsample_bytree': 0.7334121379926781, 'colsample_bylevel': 0.7146518395006158, 'colsample_bynode': 0.752601636254163, 'reg_alpha': 0.0015417171515016309, 'reg_lambda': 4.767610512151595e-08, 'sample_type': 'uniform', 'normalize_type': 'forest', 'rate_drop': 0.3636118443580445, 'skip_drop': 0.37268845698502956}. Best is trial 29 with value: 0.9536596736596736.
Лучшие параметры: {'n_estimators': 909, 'max_depth': 4, 'learning_rate': 0.07676099917888758, 'booster': 'dart', 'gamma': 0.04918081383227335, 'min_child_weight': 1.32446976014067, 'max_delta_step': 6, 'subsample': 0.6308929377426752, 'colsample_bytree': 0.7841905979503879, 'colsample_bylevel': 0.6627123748556578, 'colsample_bynode': 0.7859237669148562, 'reg_alpha': 0.0016040725625033872, 'reg_lambda': 2.859325723843246e-06, 'sample_type': 'uniform', 'normalize_type': 'forest', 'rate_drop': 0.3090730829409014, 'skip_drop': 0.33661680743543687}
Лучшее значение f1_weighted: 0.9537

Важность параметров:
booster: 0.6432
min_child_weight: 0.3355
max_depth: 0.0089
colsample_bytree: 0.0042
gamma: 0.0040
subsample: 0.0008
learning_rate: 0.0008
n_estimators: 0.0006
skip_drop: 0.0005
normalize_type: 0.0004
Number of unique classes in training data: 2
              precision    recall  f1-score   support

           0       0.67      0.80      0.73        10
           1       0.50      0.33      0.40         6

    accuracy                           0.62        16
   macro avg       0.58      0.57      0.56        16
weighted avg       0.60      0.62      0.60        16

Max RAM Usage: 0.05 MB
Training time: 4.4834 s
Inference time: 0.0110 s

Process finished with exit code 0
