[I 2025-05-24 19:55:12,617] Trial 42 finished with value: 0.9250138750138749 and parameters: {'n_estimators': 336, 'max_depth': 9, 'min_samples_split': 15, 'min_samples_leaf': 2, 'max_features': 'log2', 'bootstrap': False, 'class_weight': 'balanced', 'criterion': 'log_loss', 'min_weight_fraction_leaf': 0.04427803367175581, 'use_max_leaf_nodes': False, 'min_impurity_decrease': 0.3780177187414243, 'ccp_alpha': 0.06432891783275418}. Best is trial 2 with value: 0.9250138750138749.
[I 2025-05-24 19:55:13,122] Trial 43 finished with value: 0.9250138750138749 and parameters: {'n_estimators': 135, 'max_depth': 2, 'min_samples_split': 18, 'min_samples_leaf': 3, 'max_features': 'log2', 'bootstrap': False, 'class_weight': 'balanced', 'criterion': 'log_loss', 'min_weight_fraction_leaf': 0.07867021966013688, 'use_max_leaf_nodes': False, 'min_impurity_decrease': 0.3350366180050388, 'ccp_alpha': 0.07518273049122626}. Best is trial 2 with value: 0.9250138750138749.
[I 2025-05-24 19:55:13,841] Trial 44 finished with value: 0.9250138750138749 and parameters: {'n_estimators': 199, 'max_depth': 3, 'min_samples_split': 19, 'min_samples_leaf': 4, 'max_features': 'log2', 'bootstrap': False, 'class_weight': 'balanced', 'criterion': 'log_loss', 'min_weight_fraction_leaf': 0.11363892092820144, 'use_max_leaf_nodes': False, 'min_impurity_decrease': 0.40760944772935476, 'ccp_alpha': 0.058138313875338105}. Best is trial 2 with value: 0.9250138750138749.
[I 2025-05-24 19:55:14,481] Trial 45 finished with value: 0.9250138750138749 and parameters: {'n_estimators': 171, 'max_depth': 3, 'min_samples_split': 12, 'min_samples_leaf': 1, 'max_features': 'log2', 'bootstrap': False, 'class_weight': 'balanced_subsample', 'criterion': 'log_loss', 'min_weight_fraction_leaf': 0.020422055322158558, 'use_max_leaf_nodes': False, 'min_impurity_decrease': 0.34011323352154654, 'ccp_alpha': 0.0482662307775362}. Best is trial 2 with value: 0.9250138750138749.
[I 2025-05-24 19:55:14,825] Trial 46 finished with value: 0.9250138750138749 and parameters: {'n_estimators': 81, 'max_depth': 20, 'min_samples_split': 15, 'min_samples_leaf': 7, 'max_features': None, 'bootstrap': False, 'class_weight': 'balanced', 'criterion': 'log_loss', 'min_weight_fraction_leaf': 0.28634530371318445, 'use_max_leaf_nodes': False, 'min_impurity_decrease': 0.29966869223748793, 'ccp_alpha': 0.09335933517406195}. Best is trial 2 with value: 0.9250138750138749.
[I 2025-05-24 19:55:15,299] Trial 47 finished with value: 0.9250138750138749 and parameters: {'n_estimators': 106, 'max_depth': 5, 'min_samples_split': 14, 'min_samples_leaf': 5, 'max_features': 'sqrt', 'bootstrap': True, 'class_weight': 'balanced', 'criterion': 'log_loss', 'min_weight_fraction_leaf': 0.4675282639097062, 'use_max_leaf_nodes': False, 'min_impurity_decrease': 0.2636460566982034, 'ccp_alpha': 0.04317159431789447, 'max_samples': 0.7482293150061077}. Best is trial 2 with value: 0.9250138750138749.
[I 2025-05-24 19:55:16,073] Trial 48 finished with value: 0.9250138750138749 and parameters: {'n_estimators': 243, 'max_depth': 8, 'min_samples_split': 17, 'min_samples_leaf': 2, 'max_features': 'log2', 'bootstrap': False, 'class_weight': None, 'criterion': 'entropy', 'min_weight_fraction_leaf': 0.049043469761373346, 'use_max_leaf_nodes': False, 'min_impurity_decrease': 0.39490418088250034, 'ccp_alpha': 0.06661696996996327}. Best is trial 2 with value: 0.9250138750138749.
Best parameters: {'n_estimators': 120, 'max_depth': 2, 'min_samples_split': 16, 'min_samples_leaf': 3, 'max_features': None, 'bootstrap': False, 'class_weight': 'balanced', 'criterion': 'log_loss', 'min_weight_fraction_leaf': 0.07654324605339902, 'use_max_leaf_nodes': False, 'min_impurity_decrease': 0.32762958379134016, 'ccp_alpha': 0.049586175170277594}
Best F1 score: 0.9250
[I 2025-05-24 19:55:16,400] Trial 49 finished with value: 0.3343137254901961 and parameters: {'n_estimators': 70, 'max_depth': 2, 'min_samples_split': 13, 'min_samples_leaf': 17, 'max_features': None, 'bootstrap': True, 'class_weight': 'balanced', 'criterion': 'log_loss', 'min_weight_fraction_leaf': 0.20796267941867908, 'use_max_leaf_nodes': True, 'max_leaf_nodes': 2, 'min_impurity_decrease': 0.46877524135947274, 'ccp_alpha': 0.027020136862508218, 'max_samples': 0.8828268597255944}. Best is trial 2 with value: 0.9250138750138749.

Final model evaluation:
              precision    recall  f1-score   support

           0       0.75      1.00      0.86        15
           1       1.00      0.44      0.62         9

    accuracy                           0.79        24
   macro avg       0.88      0.72      0.74        24
weighted avg       0.84      0.79      0.77        24

Max RAM Usage: 0.11 MB
Training time: 0.2427 s
Inference time: 0.0075 s

Process finished with exit code 0
