[I 2025-05-24 22:30:35,115] Trial 41 finished with value: 0.0 and parameters: {'batch_size': 64, 'epochs': 43, 'patience': 5, 'n_lstm_layers': 1, 'bidirectional': False, 'lstm_units_0': 240, 'lstm_activation': 'relu', 'dropout_0': 0.28133666205480123, 'n_dense_layers': 1, 'dense_activation': 'relu', 'learning_rate': 8.016645219805144e-05}. Best is trial 20 with value: 0.8.
1/1 [==============================] - 1s 837ms/step
[I 2025-05-24 22:31:18,602] Trial 42 finished with value: 0.0 and parameters: {'batch_size': 64, 'epochs': 46, 'patience': 4, 'n_lstm_layers': 1, 'bidirectional': False, 'lstm_units_0': 203, 'lstm_activation': 'relu', 'dropout_0': 0.25008659693989066, 'n_dense_layers': 1, 'dense_activation': 'relu', 'learning_rate': 0.0023139651827225683}. Best is trial 20 with value: 0.8.
1/1 [==============================] - 1s 852ms/step
[I 2025-05-24 22:33:46,292] Trial 43 finished with value: 0.0 and parameters: {'batch_size': 64, 'epochs': 41, 'patience': 5, 'n_lstm_layers': 1, 'bidirectional': False, 'lstm_units_0': 179, 'lstm_activation': 'relu', 'dropout_0': 0.3123427098705105, 'n_dense_layers': 1, 'dense_activation': 'relu', 'learning_rate': 1.231542179112422e-05}. Best is trial 20 with value: 0.8.
1/1 [==============================] - 1s 915ms/step
[I 2025-05-24 22:35:29,436] Trial 44 finished with value: 0.0 and parameters: {'batch_size': 16, 'epochs': 38, 'patience': 6, 'n_lstm_layers': 1, 'bidirectional': False, 'lstm_units_0': 232, 'lstm_activation': 'relu', 'dropout_0': 0.40451680449021477, 'n_dense_layers': 1, 'dense_activation': 'tanh', 'learning_rate': 0.0006898446028570219}. Best is trial 20 with value: 0.8.
1/1 [==============================] - 1s 1s/step
[I 2025-05-24 22:36:12,512] Trial 45 finished with value: 0.0 and parameters: {'batch_size': 64, 'epochs': 34, 'patience': 4, 'n_lstm_layers': 1, 'bidirectional': False, 'lstm_units_0': 256, 'lstm_activation': 'relu', 'dropout_0': 0.01492035231870957, 'n_dense_layers': 1, 'dense_activation': 'relu', 'learning_rate': 0.0035823072077600807}. Best is trial 20 with value: 0.8.
1/1 [==============================] - 3s 3s/step
[I 2025-05-24 22:45:34,749] Trial 46 finished with value: 0.8 and parameters: {'batch_size': 64, 'epochs': 40, 'patience': 7, 'n_lstm_layers': 1, 'bidirectional': True, 'lstm_units_0': 213, 'lstm_activation': 'tanh', 'dropout_0': 0.19706924431390008, 'n_dense_layers': 1, 'dense_activation': 'relu', 'learning_rate': 0.0004353176809081328}. Best is trial 20 with value: 0.8.
1/1 [==============================] - 4s 4s/step
[I 2025-05-24 22:57:23,679] Trial 47 finished with value: 0.8 and parameters: {'batch_size': 64, 'epochs': 40, 'patience': 7, 'n_lstm_layers': 1, 'bidirectional': True, 'lstm_units_0': 214, 'lstm_activation': 'tanh', 'dropout_0': 0.19540814501124534, 'n_dense_layers': 1, 'dense_activation': 'relu', 'learning_rate': 0.00047951877341112026}. Best is trial 20 with value: 0.8.
1/1 [==============================] - 3s 3s/step
[I 2025-05-24 23:12:13,487] Trial 48 finished with value: 0.5 and parameters: {'batch_size': 64, 'epochs': 46, 'patience': 7, 'n_lstm_layers': 1, 'bidirectional': True, 'lstm_units_0': 216, 'lstm_activation': 'tanh', 'dropout_0': 0.19967289118571996, 'n_dense_layers': 1, 'dense_activation': 'relu', 'learning_rate': 0.00014503754510504423}. Best is trial 20 with value: 0.8.
1/1 [==============================] - 6s 6s/step
Best parameters: {'batch_size': 32, 'epochs': 39, 'patience': 5, 'n_lstm_layers': 1, 'bidirectional': False, 'lstm_units_0': 26, 'lstm_activation': 'tanh', 'dropout_0': 0.09107272375037292, 'n_dense_layers': 2, 'dense_units_0': 78, 'dense_activation': 'relu', 'learning_rate': 0.0011392915542686277}
Best f1 score: 0.8000
[I 2025-05-24 23:14:34,993] Trial 49 finished with value: 0.0 and parameters: {'batch_size': 64, 'epochs': 40, 'patience': 8, 'n_lstm_layers': 2, 'bidirectional': True, 'lstm_units_0': 27, 'lstm_units_1': 88, 'lstm_activation': 'tanh', 'dropout_0': 0.1686214678351783, 'dropout_1': 0.23413913043727252, 'n_dense_layers': 1, 'dense_activation': 'relu', 'learning_rate': 0.0004418000945601557}. Best is trial 20 with value: 0.8.
Epoch 1/39
2/2 [==============================] - 10s 4s/step - loss: 0.6887 - accuracy: 0.5312 - val_loss: 0.6791 - val_accuracy: 0.6250
Epoch 2/39
2/2 [==============================] - 1s 690ms/step - loss: 0.6818 - accuracy: 0.5312 - val_loss: 0.6728 - val_accuracy: 0.6250
Epoch 3/39
2/2 [==============================] - 1s 688ms/step - loss: 0.6836 - accuracy: 0.5312 - val_loss: 0.6687 - val_accuracy: 0.6250
Epoch 4/39
2/2 [==============================] - 1s 688ms/step - loss: 0.6749 - accuracy: 0.5312 - val_loss: 0.6672 - val_accuracy: 0.6250
Epoch 5/39
2/2 [==============================] - 1s 690ms/step - loss: 0.6730 - accuracy: 0.5312 - val_loss: 0.6680 - val_accuracy: 0.6250
Epoch 6/39
2/2 [==============================] - 1s 683ms/step - loss: 0.6664 - accuracy: 0.5312 - val_loss: 0.6676 - val_accuracy: 0.6250
Epoch 7/39
2/2 [==============================] - 1s 689ms/step - loss: 0.6647 - accuracy: 0.5469 - val_loss: 0.6669 - val_accuracy: 0.6250
Epoch 8/39
2/2 [==============================] - 1s 686ms/step - loss: 0.6538 - accuracy: 0.5469 - val_loss: 0.6652 - val_accuracy: 0.6250
Epoch 9/39
2/2 [==============================] - 1s 689ms/step - loss: 0.6428 - accuracy: 0.6562 - val_loss: 0.6632 - val_accuracy: 0.7500
Epoch 10/39
2/2 [==============================] - 1s 685ms/step - loss: 0.6319 - accuracy: 0.7969 - val_loss: 0.6596 - val_accuracy: 0.7500
Epoch 11/39
2/2 [==============================] - 1s 687ms/step - loss: 0.6207 - accuracy: 0.8125 - val_loss: 0.6533 - val_accuracy: 0.7500
Epoch 12/39
2/2 [==============================] - 1s 689ms/step - loss: 0.5955 - accuracy: 0.9062 - val_loss: 0.6455 - val_accuracy: 0.7500
Epoch 13/39
2/2 [==============================] - 1s 698ms/step - loss: 0.5642 - accuracy: 0.9062 - val_loss: 0.6352 - val_accuracy: 0.7500
Epoch 14/39
2/2 [==============================] - 1s 689ms/step - loss: 0.5059 - accuracy: 0.9219 - val_loss: 0.6213 - val_accuracy: 0.7500
Epoch 15/39
2/2 [==============================] - 1s 687ms/step - loss: 0.4463 - accuracy: 0.9219 - val_loss: 0.6149 - val_accuracy: 0.7500
Epoch 16/39
2/2 [==============================] - 1s 685ms/step - loss: 0.4038 - accuracy: 0.9219 - val_loss: 0.6226 - val_accuracy: 0.7500
Epoch 17/39
2/2 [==============================] - 1s 696ms/step - loss: 0.3565 - accuracy: 0.9219 - val_loss: 0.7313 - val_accuracy: 0.6875
Epoch 18/39
2/2 [==============================] - 1s 691ms/step - loss: 0.4002 - accuracy: 0.8750 - val_loss: 0.7538 - val_accuracy: 0.6875
Epoch 19/39
2/2 [==============================] - 1s 684ms/step - loss: 0.6695 - accuracy: 0.7031 - val_loss: 0.6355 - val_accuracy: 0.7500
Epoch 20/39
2/2 [==============================] - 1s 683ms/step - loss: 0.3587 - accuracy: 0.8906 - val_loss: 0.5098 - val_accuracy: 0.8125
Epoch 21/39
2/2 [==============================] - 1s 687ms/step - loss: 0.3912 - accuracy: 0.8750 - val_loss: 0.5242 - val_accuracy: 0.8125
Epoch 22/39
2/2 [==============================] - 1s 686ms/step - loss: 0.4015 - accuracy: 0.8750 - val_loss: 0.5209 - val_accuracy: 0.8125
Epoch 23/39
2/2 [==============================] - 1s 690ms/step - loss: 0.3954 - accuracy: 0.8750 - val_loss: 0.5093 - val_accuracy: 0.8125
Epoch 24/39
2/2 [==============================] - 1s 683ms/step - loss: 0.3784 - accuracy: 0.8750 - val_loss: 0.6176 - val_accuracy: 0.7500
Epoch 25/39
2/2 [==============================] - 1s 683ms/step - loss: 0.3820 - accuracy: 0.8750 - val_loss: 0.6665 - val_accuracy: 0.7500
Epoch 26/39
2/2 [==============================] - 1s 689ms/step - loss: 0.3451 - accuracy: 0.8906 - val_loss: 0.7988 - val_accuracy: 0.6875
Epoch 27/39
2/2 [==============================] - 1s 685ms/step - loss: 1.0204 - accuracy: 0.5469 - val_loss: 0.7642 - val_accuracy: 0.6875
Epoch 28/39
2/2 [==============================] - 1s 695ms/step - loss: 0.3162 - accuracy: 0.9062 - val_loss: 0.6298 - val_accuracy: 0.7500
1/1 [==============================] - 1s 1s/step
              precision    recall  f1-score   support

         0.0       1.00      0.70      0.82        10
         1.0       0.67      1.00      0.80         6

    accuracy                           0.81        16
   macro avg       0.83      0.85      0.81        16
weighted avg       0.88      0.81      0.81        16

Max RAM Usage: 18.22 MB
Training time: 42.81 s
Inference time: 1.1909 s

Process finished with exit code 0
